video_id,video_title,channel_title,view_count,like_count,total_comments,duration_minutes,comments_collected,total_comment_likes,avg_comment_likes,published_at
I0Sdbx3ePrg,Trump Almost Lost it With Zelensky in the Oval Office,Celebrity Stories,3080395,97467,3733,1.0,146,14807.0,101.41780821917808,2025-02-28 19:39:04
IDhvpE-dSJU,Ukraina Tuding AS &#39;Menghancurkan&#39; Tatanan Dunia seusai Perundingan Zelensky-Trump Berakhir Buntu,Tribunnews,9300,182,13,0.8166666666666667,0,0.0,,2025-03-07 08:03:08
IMyvle_dtPo,"Zelensky Writes Long Letter After Being Lectured By Trump, Vance; Makes This Offer To US | Ukraine",Hindustan Times,194722,1757,1512,4.016666666666667,150,4181.0,27.873333333333335,2025-03-01 15:07:05
ITQEE3DsVsY,Trump Schools Zelensky After Heated Argument Breaks Out During Bilateral Talks | WION Shorts,WION,5579,122,15,0.48333333333333334,0,0.0,,2025-02-28 21:41:44
IcIJ1d-64yw,Premier échange &quot;constructif&quot; : Zelensky a rencontré Trump au Vatican • FRANCE 24,FRANCE 24,79107,719,152,1.5833333333333333,20,223.0,11.15,2025-04-26 12:33:12
Ika4IYcC8sw,TRUMP HUMILLA A ZELENSKY en TENSA REUNIÓN en la CASA BLANCA | Gestión,Diario Gestión,19370,117,112,1.4666666666666666,10,130.0,13.0,2025-02-28 20:44:38
IxkBYZHIamM,US President Trump and Ukraine&#39;s President Zelenskyy hold press conference | DW News,DW News,882718,8744,4764,55.166666666666664,237,30491.0,128.65400843881858,2025-02-28 18:55:57
J07_cHnRmTQ,LIVE: Donald Trump Shuts Down Peace Talks in Huge Clash with Zelensky in White House |JD Vance |N18G,CNBC-TV18,2222788,14695,550,715.0,38,855.0,22.5,2025-03-01 12:10:26
JBK9jjVtnYA,Ukrainian soldiers react to Zelenskyy and Trump&#39;s Oval Office meeting,Associated Press,527471,6709,4224,1.15,141,15317.0,108.63120567375887,2025-03-02 11:26:30
JDAxnUdnx7w,Trump Responds to Zelensky&#39;s Criticism Amid Record Russian Air Assault on Ukraine,KPRC 2 Click2Houston,7068,43,59,1.7666666666666666,3,88.0,29.333333333333332,2025-05-26 13:59:59
JDrILiQsoQQ,Barbosa: Único vencedor das discussões entre Trump e Zelensky é Putin; Veja íntegra | CNN PRIME TIME,CNN Brasil,88759,2285,558,6.383333333333334,54,1139.0,21.09259259259259,2025-03-01 00:48:40
JNH8wpa0hDM,World leaders react to Trump-Zelensky clash in Oval Office • FRANCE 24 English,FRANCE 24 English,450091,3433,2250,2.033333333333333,142,7059.0,49.7112676056338,2025-03-01 01:12:55
JNiSZvzQkak,US Intelligence Officer gets emotional after Trump and Zelenskyy’s explosive meeting | LBC,LBC,1460551,48584,11402,5.933333333333334,299,99072.0,331.3444816053512,2025-02-28 20:01:13
JgIdbN3OKV4,Trump Zelenskyy Meeting | Heated Exchange Between JD Vance &amp; Zelensky | US Ukraine Relations,HW News English,545404,8648,596,0.7333333333333333,51,1604.0,31.45098039215686,2025-03-01 11:24:28
Jko3SKQMenA,La rencontre entre Donald Trump et Volodymyr Zelensky vire à l&#39;affrontement à Washington,Radio-Canada Info,233667,0,1433,12.416666666666666,144,3792.0,26.333333333333332,2025-02-28 18:54:57
JpG03zjl8is,Zelensky doesn&#39;t call Trump and Vance handsome and the meeting turns to chaos | SNL | BINGE,BINGE,3391592,84809,2503,1.4,168,28973.0,172.45833333333334,2025-03-04 06:00:13
KBUoRW_vCWI,"🚨 PRIMERAS IMÁGENES | &quot;¡Fuera de mi casa!&quot;, dice TRUMP a ZELENSKI y el ucraniano deja la CASA BLANCA",Canal 26,239001,2855,1486,2.533333333333333,117,3806.0,32.52991452991453,2025-02-28 19:57:42
KDv_hwh0P1g,"After the Trump-Zelensky debate, NATO #trump #nato #zelensky #usa #politics",World History,35643,1141,72,0.5666666666666667,13,118.0,9.076923076923077,2025-03-03 18:13:13
KKXsed6nc7g,#Loret. Trump y Zelenski protagonizan fuerte discusión en la Casa Blanca. #Latinus,Latinus_us,2329059,74356,1911,3.0166666666666666,97,3562.0,36.72164948453608,2025-03-01 04:46:15
KawLE9jfqBg,Trump e Zelensky hanno firmato l’accordo sulle terre rare 🇺🇸🇺🇦 #trump,Sasha Rizzo,13256,148,24,1.0666666666666667,0,0.0,,2025-05-01 16:00:23
KwCDVvl_9X0,"Kiev sụp đổ niềm tin: Zelensky đổ lỗi Trump, lòng dân Ukraine ngả về Nga, Medvedev ấn “nút hủy diệt”",GÓC NHÌN THẾ GIỚI,36115,418,37,13.583333333333334,0,0.0,,2025-05-23 02:36:01
L6gVvnjoR88,Trump &amp; JD just EMBARRASSED Zelensky in front of the entire world...,Candace Owens,251694,19576,3391,2.966666666666667,175,9349.0,53.42285714285714,2025-03-01 01:53:49
LJpcewG4qrc,"Pope Funeral: Trump, Zelensky Awkward Moment? Watch How Vatican Seated Them To Avoid…| USA| Ukraine",Hindustan Times,440428,2203,1307,3.1,137,3326.0,24.277372262773724,2025-04-26 10:00:33
LPrMKsfk7oI,😡 Así fue la tensa discusión entre Trump y Zelenski,Página12,105264,1783,287,1.15,25,527.0,21.08,2025-03-01 00:00:18
LT9dz6r88cI,Trump e Zelensky se reúnem à margem do funeral do papa Francisco | AFP,AFP Português,113408,2786,0,1.25,0,0.0,,2025-04-26 14:22:40
LYS1GAUXMGs,ABD Başkanı Trump ile Ukrayna Devlet Başkanı Zelenskiy arasında tansiyon yükseldi,Anadolu Ajansı,158622,475,285,2.3,41,1017.0,24.804878048780488,2025-02-28 19:32:54
LbWXefUOaBU,Trump Adviser Details Shocking Moment Zelensky Was ‘Kicked Out’ of White House; &#39;He Was in Shock&#39;,Oneindia News,108484,751,509,3.9833333333333334,62,921.0,14.85483870967742,2025-03-02 11:40:21
Lem5Zci57XM,Trump Zelensky | Trump Hints At The Revival Of Ukraine Minerals Deal Amid Clash With Zelensky,NDTV,9805,184,15,1.0333333333333334,0,0.0,,2025-03-04 05:58:03
M9iFgpUaRvY,Un départ de Zelensky en ligne de mire pour Donald Trump ?｜LCI,LCI,88295,835,758,10.366666666666667,54,965.0,17.87037037037037,2025-03-11 14:00:26
ME7_UVusoz0,&quot;Reunião Explosiva: O Conflito Entre Zelensky e Trump Que Saiu do Controle!&quot;,Podcast Rei,174704,8577,90,0.8666666666666667,8,174.0,21.75,2025-03-07 10:00:23
MGgCR5Drm9Q,Donald Trump BREAKS SILENCE after hour-long phone call with Zelensky,The Mirror,54618,408,510,8.766666666666667,46,1114.0,24.217391304347824,2025-03-20 09:30:13
MOqOWkx2hys,Trump Zelensky Clash: US President Trump Shuts Ukraine&#39;s Zelensky On Reply To VP Vance |WION Shorts,WION,31169,576,93,0.5,17,260.0,15.294117647058824,2025-02-28 21:39:52
Md1E-k505iw,"Duta Besar Ukraina &#39;Tepok Jidat&#39; saat Zelensky Debat Sengit vs Trump, Frustrasi Hubungan AS Memburuk",Tribunnews,36416,513,16,0.9333333333333333,0,0.0,,2025-03-03 07:04:10
Mm083wN86v4,Trump and Zelensky meet one-on-one inside St Peter&#39;s Basilica ahead of Pope&#39;s funeral,Sky News Australia,471386,6815,2137,6.55,150,8061.0,53.74,2025-04-26 12:27:50
MnYNw4ptGQE,"Zelenskyy meeting was &#39;a trap&#39; set up by Trump, says Matt Frei",LBC,788553,16114,5161,7.816666666666666,238,29910.0,125.67226890756302,2025-03-01 11:30:21
MzJ2N27mV_U,Grote ruzie tussen Trump en Zelensky: wat is er aan de hand?,NOS Jeugdjournaal,90579,917,0,2.8,0,0.0,,2025-03-01 18:31:47
N-SY4bU5VHw,Trump Calls Out Putin &amp; Zelensky Over Russia-Ukraine Truce Deadlock | Subscribe To Firstpost | N18G,Firstpost,10323,104,4,0.6666666666666666,1,5.0,5.0,2025-03-31 08:58:59
NC9Z1srGuQM,Trump vs  Zelensky A Diplomatic Clash,Bmore String ,497,19,1,1.0333333333333334,0,0.0,,2025-03-02 02:45:19
NO0qUkEXgAg,LIVE | Chaos Erupts In Trump Zelensky Trump Meeting | Russia Ukraine War | JD Vance | Putin | N18G,CNN-News18,50429,351,579,59.86666666666667,85,1522.0,17.905882352941177,2025-02-28 19:05:14
NWvn0q89ONY,Trump administration asks Zelenskyy to leave White House after tense exchange,CBS News,156049,1296,1519,5.7,156,7851.0,50.32692307692308,2025-02-28 19:49:59
NaBPFnTNkcU,Trump&#39;s First Reaction After Zelensky Fallout | Ukrainian President Can’t Return To White House?,Hindustan Times,81778,892,447,4.35,53,1299.0,24.50943396226415,2025-03-01 02:15:01
NgKPPB9imTo,Trump Zelenskyy Meeting | Heated Exchange Between Trump and Zelensky | JD Vance | US | Ukraine,HW News English,72054,1199,81,1.1833333333333333,7,98.0,14.0,2025-03-01 11:41:29
Nh4ojeijk48,WATCH: Zelenskyy leaves White House after Trump &#39;kicked him out&#39;,Fox News,2542492,40768,24819,4.2,267,71668.0,268.4194756554307,2025-02-28 18:53:19
NzZVOmSaDbU,"Breaking: President Trump and VP Vance Spar with Zelensky in the Oval Office, with Red Scare Hosts",Megyn Kelly,1177016,37855,9507,10.55,263,52055.0,197.9277566539924,2025-02-28 20:20:38
Nzff8QCNSfU,"[FULL] Percakapan Cekcok Zelensky, Trump, dan Vance di Ruang Oval AS",Kompas.com,345985,2532,1284,15.483333333333333,86,2654.0,30.86046511627907,2025-03-03 05:46:08
O-eDejb4ha0,Jäger: Selenskyj ist in eine Falle gelaufen - &quot;Da ist ein Manuskript abgespielt worden&quot;,ntv Nachrichten,1132922,18987,8165,6.1,182,23545.0,129.36813186813185,2025-02-28 19:58:56
O-vqIRtwheQ,🇺🇸 Le président américain #Trump déclare que #Zelensky « peut avoir la paix ou se battre pendant…,Lejaunecorp,6435,20,0,0.13333333333333333,0,0.0,,2025-04-25 15:49:09
OKycBP_cg8o,What Kaitlan Collins saw during fiery Trump-Zelensky argument,CNN,5179176,70095,48399,20.983333333333334,268,144102.0,537.6940298507462,2025-02-28 19:54:21
OTJUXQmZFvY,Trump Zelenskiy Tartışmasında Gerilimin Yükseldiği 5 Dakika - Uzun Versiyon Türkçe Altyazılı,CNBC-e,30074,116,23,5.15,6,87.0,14.5,2025-03-01 15:40:04
O_B6j6cJsFo,Trump: &#39;It&#39;s sort of a stupid question&#39;,Daily Mail World,3378998,94037,3322,0.3333333333333333,183,51049.0,278.95628415300547,2025-02-28 19:30:22
OeUZI5RnYGg,Jon Stewart on Trump’s Heel Turn on Zelenskyy In Favor of Putin’s New World Order | The Daily Show,The Daily Show,8966405,232988,20904,24.116666666666667,328,226521.0,690.6128048780488,2025-03-04 04:00:17
OpFFdcY0E0E,Reporter asks Zelensky why he doesn’t wear a suit during meeting with Trump,Middle East Eye,2814768,51730,7999,0.5666666666666667,169,62309.0,368.6923076923077,2025-03-01 04:55:25
OphAIaqOITw,Trump VS Zelensky : comment la rencontre a viré au clash du siècle dans le Bureau ovale,Le Parisien,1611682,13910,2887,8.533333333333333,200,27692.0,138.46,2025-03-01 19:43:54
OtJHLR8HZYU,Zelensky e Trump tiveram um encontro &quot;muito positivo&quot; em Roma,Renascença,3435,82,0,0.36666666666666664,0,0.0,,2025-04-26 13:04:11
P-sffImulgI,Il vero significato dietro le parole di Trump #trump #zelensky #ucraina #usa #perte #news #neiperte,Roberto Saviano Official,98562,2888,172,2.783333333333333,17,135.0,7.9411764705882355,2025-03-03 12:00:36
P07-8ZLiChI,Zelensky vs Trump | Reaction From The Rest Is Politics,The Rest Is Politics,1044967,23794,6887,49.88333333333333,224,40167.0,179.31696428571428,2025-02-28 20:53:27
PHddlShV51U,"Trump Asks Zelensky To Leave White House After Verbal Fight, Cancels Talks: ‘He Can Come Back When…’",Hindustan Times,1043801,6939,4428,5.483333333333333,174,17572.0,100.98850574712644,2025-02-28 19:38:22
PV8CAxepM08,"Dalla accuse alla lite, i cinque minuti dello scontro tra Trump a Zelensky (sottotitoli italiano)",Il Fatto Quotidiano,357314,3070,2143,5.083333333333333,167,6884.0,41.221556886227546,2025-03-01 13:30:16
P_WnZZ2U8xA,LULA SOBRE DISCUSSÃO ENTRE TRUMP E ZELENSKY: &quot;HÁ TEMPOS NÃO SE VIA UMA CENA TÃO GROTESCA&quot;,Itatiaia,58937,1404,1005,2.8833333333333333,65,1726.0,26.553846153846155,2025-03-01 21:00:26
Q1mE-kByxc8,Trump Vs Zelensky | Watch tense Oval Office argument Between Zelensky And Trump | Pakistan News,Express News,183474,2687,249,8.666666666666666,21,297.0,14.142857142857142,2025-03-01 07:35:41
Q36WvtF0vus,Trump-Zelensky : &quot;C&#39;était une volonté je crois de créer un moment de télévision&quot;,RTL  ,104783,1342,227,0.8833333333333333,33,433.0,13.121212121212121,2025-02-28 21:30:03
Q5pX8OIPudU,Zelensky Gives Trump a Surprise Haircut 🤣Kim &amp; Putin Can&#39;t Stop Laughing!#shorts,Sneaky Brief ,81070,0,6,0.25,0,0.0,,2025-05-30 13:44:36
QFvHPoSSqrI,Zelensky’s ‘DESPERATE CALL’ To Trump; ‘Please Don’t Stop…’ Appeal As Russia Attacks Kyiv,Times Of India,56610,735,587,3.466666666666667,62,2244.0,36.193548387096776,2025-05-25 17:15:01
QUXi5eRsI7Q,What EVERYONE Missed in the Trump Zelensky Fight,Scott Rouse,104749,7108,2722,24.633333333333333,135,2208.0,16.355555555555554,2025-03-02 00:30:06
QilowY-D-yA,Russia Ukraine War | Ukrainians React To Trump Zelensky Spat | Trump Zelenskyy Meeting | N18G,CNN-News18,123106,940,1279,5.9,124,3600.0,29.032258064516128,2025-03-01 08:33:37
QjUfw8-214c,"L&#39;INTERA incredibile lite tra Trump, JD Vance e Zelensky: &quot;Tu giochi con la Terza Guerra Mondiale&quot;",Vista Agenzia Televisiva Nazionale,438008,3097,3016,7.266666666666667,138,5097.0,36.93478260869565,2025-02-28 20:51:40
QjnNbvPIEOI,BREAKING: Trump KICKS Zelensky OUT After INSANE Shouting Match,Breaking Points,404593,12325,11967,13.283333333333333,284,73902.0,260.21830985915494,2025-02-28 19:12:43
Qmea-M9BvhE,LIVE: Zelensky meets Trump at the White House,Times News,252383,1718,299,242.2,51,1017.0,19.941176470588236,2025-02-28 20:16:56
Qp_tQxPumiQ,Orsini: &quot;Solidarizzo con Zelensky: Trump sfrutta la disperazione degli ucraini &quot;,Il Fatto Quotidiano,116367,1568,1611,2.7666666666666666,145,4369.0,30.131034482758622,2025-03-02 15:30:09
QwVSrDR41JQ,"Zelensky, Trump In War Of Words Over Ukraine&#39;s Future | World News | WION",WION,10851,115,69,13.45,5,49.0,9.8,2025-03-01 02:05:40
R6gjusB_oiA,US Pres. Trump at Ukraine Pres. Zelensky nagkasagutan sa White House |  TV Patrol,ABS-CBN News,144860,1194,1159,4.3,75,1979.0,26.386666666666667,2025-03-01 12:17:57
R8E3arXq75Q,"Trump, Musk and Rubio Meeting Cold Open - SNL",Saturday Night Live,7217843,153821,9448,6.333333333333333,233,107192.0,460.05150214592277,2025-03-09 05:20:18
RNjI6XifuoE,Trump kicked Zelensky out of the White House #funny #trump #zelensky,Vrhunske Price,4885592,0,679,0.15,53,816.0,15.39622641509434,2025-03-01 21:47:03
RQxUmG3rBzs,Johan reageert op ruzie tussen Trump en Zelensky: &#39;Dit kun je verwachten!&#39; | VANDAAG INSIDE,Vandaag Inside,147279,1040,1196,3.5833333333333335,99,3439.0,34.73737373737374,2025-03-01 07:00:24
ReJM3mqDSfw,"Trump Berates Zelensky, Vance Wants a Thank You, Jimmy&#39;s Oscars Recap &amp; Guillermo on the Red Carpet",Jimmy Kimmel Live,3569180,97182,6772,16.65,259,97278.0,375.5907335907336,2025-03-04 04:45:03
RlTrrGVx9cA,Trump-Zelensky&#39;s Oval Office Showdown Triggers Response From World Leaders | N18G,Firstpost,255695,2132,1025,8.05,107,2682.0,25.065420560747665,2025-03-01 13:44:21
SLhOjotKHt0,Analyse du Langage Corporel de Trump et Zelensky au Vatican,Jimmy Dussau,13346,410,180,14.383333333333333,21,245.0,11.666666666666666,2025-05-01 19:56:22
SN1mkzV8qko,Trump-Zelensky Clash News: जब White House में तीखी बहस के बीच Trump ने Zelensky को मारा धक्का!,TIMES NOW Navbharat,1827932,38794,757,0.4,38,1915.0,50.39473684210526,2025-03-01 07:30:58
STV1Gmg5KtY,Trump et Poutine contre Zelensky : la stratégie du déclassement • FRANCE 24,FRANCE 24,45918,405,144,7.566666666666666,14,165.0,11.785714285714286,2025-03-07 14:22:16
S_YtXWVfkJE,BREAKING NEWS: Trump And Zelensky Oval Office Meeting Ends In Utter Disaster In Front Of The Cameras,Forbes Breaking News,7270985,77588,30577,49.43333333333333,278,140848.0,506.6474820143885,2025-02-28 19:15:01
SaZEAMzJQvI,Zelensky umiliato da Trump. La mossa giusta di Meloni - Zuppa di Porro,Nicola Porro,51178,2658,962,16.15,125,4335.0,34.68,2025-03-01 11:07:42
ScEbZFo7s90,Lula diz que Trump humilhou Zelensky e chama bate-boca na Casa Branca de &quot;cena grotesca&quot; #Shorts,Jovem Pan News,46969,855,674,1.4166666666666667,36,1262.0,35.05555555555556,2025-03-02 13:47:00
SlyWs6yi29k,"AMERICANS appear DIVIDED over TRUMP, ZELENSKY Oval Office CONFRONTATION",Diario AS,37388,245,567,2.2,71,1140.0,16.056338028169016,2025-03-01 21:31:52
TI0GXDjmEL8,Volodymyr Zelensky et Donald Trump coupent court à leur rencontre à la Maison-Blanche,Le Nouvel Obs,447411,3006,3201,2.6666666666666665,155,6996.0,45.13548387096774,2025-02-28 23:15:37
TNivNL3rQ2E,"Zelensky, Trump get into heated argument",Kyiv Independent,6148,158,78,2.0833333333333335,9,208.0,23.11111111111111,2025-02-28 20:08:11
TXa04dUyiBE,Crean video de “pelea” entre Trump y Zelensky #shorts,El Universal,2622884,0,725,0.75,42,1928.0,45.904761904761905,2025-03-01 19:36:35
T_BkXbwDmAs,Trump Strapazza Zelensky (Versione Integrale),Ulisse,509444,7896,2241,25.683333333333334,136,4815.0,35.404411764705884,2025-03-02 19:33:50
TlzKzpWIScI,Toàn cảnh 10 phút cuộc họp của ông Zelensky với ông Trump biến thành khẩu chiến gay gắt,BẢN TIN CHIẾN SỰ MỚI NHẤT,102,1,1,18.133333333333333,0,0.0,,2025-03-04 03:00:22
UBH3VL_QRVs,Erdoğan son beş günde hangi liderlerle görüştü... #shorts #zelensky #trump,Odatv,2687,16,2,0.9,0,0.0,,2025-05-16 11:15:08
UGhcWMjHKMM,WATCH: Trump And Zelensky Arrive At Pope Francis Funeral Within Moments Of Each Other After Meeting,Forbes Breaking News,168449,721,472,1.05,65,1087.0,16.723076923076924,2025-04-26 17:19:35
UH1WNGu4lOQ,REPLAY: Donald Trump and Volodymyr Zelensky meet at the White House,WFAA,1018865,5763,305,714.95,53,1004.0,18.943396226415093,2025-03-01 05:29:04
UMK31FF2kn0,"Trump, Zelensky Shocked? Putin Gives Stunning Answer On &#39;Reunifying&#39; Ukrainian Parts Into Russia",Hindustan Times,328054,5272,1073,10.6,85,2915.0,34.294117647058826,2025-05-05 16:19:07
UOf_djwyREA,Trump: &#39;What if a bomb drops on your head right now?&#39;,Daily Mail World,293858,9660,1588,0.8666666666666667,205,10748.0,52.42926829268293,2025-02-28 21:29:23
UdjZ04XfKpY,FULL GAGGLE: Karoline Leavitt Speaks To Reporters After Trump-Zelensky Oval Office Clash,Forbes Breaking News,1421042,20152,8179,2.033333333333333,170,17889.0,105.22941176470589,2025-03-01 01:08:05
UoX8W8ZkiNc,Eminem says f Trump #eminem #zelensky #trump #donaldtrump #rap #rapmusic #trending #politics #music,DMC_Visi,7797,408,43,0.48333333333333334,6,86.0,14.333333333333334,2025-03-03 22:13:21
UvezCTNGLfk,LIVE: Donald Trump meets Zelensky at White House for crunch talks,The Sun,108285,768,401,176.0,54,1285.0,23.796296296296298,2025-02-28 18:55:48
Uxc-M4I_lQY,&#39;I was horrified!&#39;: Sen. Klobuchar condemns GOP backing Trump and Vance attacks on Zelenskyy,MSNBC,1222616,25559,7764,6.366666666666666,205,53836.0,262.6146341463415,2025-03-01 04:00:20
VH7LfElC-lY,Trump-Zelensky Clash News: जब White House में Donald Trump- Zelensky के बीच हुई तीखी बहस #shorts,TIMES NOW Navbharat,2074379,71630,1976,0.9333333333333333,79,8545.0,108.16455696202532,2025-03-01 05:08:34
VMKKCHr1Cq4,Le preoccupazioni a Kiev dopo lo scontro tra Trump e Zelensky,La Repubblica,6898,73,0,1.4333333333333333,0,0.0,,2025-03-01 16:08:42
VO6CgMzOHUI,"Trump calls Ukraine&#39;s Zelensky ‘disrespectful,’ says he&#39;s &#39;gambling with World War III&#39;",The Boston Globe,8765,329,12,2.6166666666666667,2,16.0,8.0,2025-02-28 21:10:07
VOUXCLaFkNY,Tổng thống Trump và Tổng thống Zelensky thông báo kết quả điện đàm song phương,Báo Điện tử Tiếng nói Việt Nam (VOV),6390,39,0,1.8666666666666667,0,0.0,,2025-03-20 07:07:50
VUqEmiY8v7M,"Trump Zelensky Meeting | Zelensky Gives A Big Message To Donald Trump, After Heated Meeting | N18G",CNN-News18,22879,90,44,6.466666666666667,3,38.0,12.666666666666666,2025-03-01 15:38:46
VYs8b5CTTQI,Joe Rogan On Trump Confronting Zelensky,JREHighlights,19470,804,39,0.7166666666666667,4,54.0,13.5,2025-03-01 21:05:52
VdGREDvFM20,Trump&#39;ın Oyunu Elinde Patladı! Zelenski Gibi Yapacaktı Ama Güney Afrika Lideri Dersini Verdi,Haber Global,836247,4989,839,3.716666666666667,52,3768.0,72.46153846153847,2025-05-22 10:30:19
Vh8y-Gw1hJU,Trump vs Zelensky #kungfu #funny #trump,AIxAnimation 666,4566315,5396,28,0.08333333333333333,2,15.0,7.5,2025-06-01 11:46:38
VoHMmkhzEVI,"Trump vs. Zelensky: Dropping Rhymes, Picking Fights!",Entertaining AI,458339,3764,485,2.65,45,989.0,21.977777777777778,2025-03-08 12:00:47
VvOP1Lo36NA,TRUMP KHÔI PHỤC VIỆN TRỢ QUÂN SỰ CHO UKRAINE,58WIN BIẾT CHƯA,4,0,0,0.5666666666666667,0,0.0,,2025-03-12 12:30:47
W1_JntTokY0,SALIDA de ZELENSKY FURIOSO tras su DISCUSIÓN con TRUMP en la CASA BLANCA,Diario AS,437773,3458,1982,4.25,145,5612.0,38.703448275862065,2025-02-28 19:03:05
W5LJS5iDGaU,"Trump, Zelenskyy, and JD Vance face off at the White House",CGTN Europe,8692808,190796,4215,1.2666666666666666,144,32317.0,224.42361111111111,2025-02-28 20:35:03
WDNP4AxYgNM,Tin nóng quốc tế: Cảm xúc trái ngược của bộ 3 Trump - Putin - Zelensky về lệnh ngừng bắn,BẢN TIN CHIẾN SỰ MỚI NHẤT,143,3,0,18.616666666666667,0,0.0,,2025-03-16 07:00:21
WHW56QvbHQo,Zelensky Takes U Turn Following Trump Clash | Vantage with Palki Sharma | N18G,Firstpost,450115,11803,394,0.9833333333333333,27,588.0,21.77777777777778,2025-03-05 17:39:13
WRL6Lc9j9Rg,Con IA crean video de “pelea” entre Trump y Zelensky,El Universal,517419,0,1139,1.2666666666666666,65,4746.0,73.01538461538462,2025-03-01 04:07:00
WmS45-JAOI4,Siyaset havası vol2 #shorts #siyaset #receptayyiperdoğan #putin #trump #gündem #macron #zelensky,Absürt Medya,974353,4029,53,0.48333333333333334,4,24.0,6.0,2025-05-16 09:07:13
WmxLL1qFsec,"Trump-Zelensky Meet: Trump Slams Zelensky&#39;s &#39;Attitude&#39;, Says It Is a Tough Deal to Make | WION News",WION,22763,297,308,14.133333333333333,40,643.0,16.075,2025-02-28 19:27:24
Wp2d7PNECOc,European leaders back Zelensky after Trump clash | BBC News,BBC News,2103924,21740,22282,8.683333333333334,273,111922.0,409.97069597069594,2025-03-01 13:30:20
X9LTjAYfRMY,Trump Blasts ‘Putin Hater’ Zelensky In White House Before Cutting Short Talks With Ukraine President,Hindustan Times,31900,622,239,8.083333333333334,39,572.0,14.666666666666666,2025-02-28 19:17:54
XAYXwHoQE48,Nigel Farage reacts to Trump and Zelenskyy&#39;s shouting match | LBC,LBC,251830,2980,4259,12.55,197,21311.0,108.17766497461929,2025-03-03 10:08:00
XDLazDwiP_o,Trump Zelensky Meeting – The Ultimate AI ! 🤯#shorts #trump #trumpzelensky,Patriot's Voice,329812,0,259,0.6333333333333333,24,1244.0,51.833333333333336,2025-03-04 22:30:03
XHpg2JtAVms,Trump Zelenski kavgası #zelensky #trump #ovaloffice #ukrayna,Emrah İriç,9533,373,27,1.7666666666666666,1,7.0,7.0,2025-02-28 23:26:02
XK-vkjIsqFg,Trump Zelensky press Conference Cancelled after Clash In White House | WION Shorts,WION,4304,67,8,0.6333333333333333,2,12.0,6.0,2025-02-28 23:27:12
XbpnHmYToHM,Zelensky Trump Vance Debate: VP Vance Accuses Zelensky Of Being Disrespectful | WION Shorts,WION,16561,273,66,0.45,11,144.0,13.090909090909092,2025-02-28 21:37:46
Xfp9I_VhkL0,ట్రంప్ vs జెలెన్స్కీ వాదన | Trump vs Zelensky in White House |Ukraine Russia| Ravi Telugu Traveller,Ravi Telugu Traveller,404585,20961,1532,24.75,57,1559.0,27.350877192982455,2025-03-01 05:15:06
XpDaJc0gx4c,Eklat zwischen Trump und Selenskyj - Weidel: Keine Schuld bei USA | Markus Lanz vom 06. März 2025,ZDFheute Nachrichten,2636135,17620,21227,24.35,176,28173.0,160.07386363636363,2025-03-08 12:00:43
Y3DiI0PRPlE,"TRUMP CHỈ TRÍCH ZELENSKY, CẢNH BÁO UKAINE “KHÔNG TỒN TẠI “ #TinNong #ThoiSu #donaldtrump  #shorts",58WIN BIẾT CHƯA,1289,6,0,0.48333333333333334,0,0.0,,2025-03-10 12:49:36
Y5vcARnZ8nY,Trump Zelensky Meeting के बीच जब पत्रकार ने ज़ेलेंस्की से पूछा कि वो सूट क्यों नहीं पहनते? #shorts,BBC News Hindi,1463228,0,1493,0.6,74,9729.0,131.47297297297297,2025-03-01 08:19:42
Y7e-RA2NP_s,Karoline Leavitt speaks on Trump-Zelenskyy meeting  | LiveNOW from FOX,LiveNOW from FOX,490441,7071,4034,1.7666666666666666,278,7246.0,26.06474820143885,2025-03-01 01:05:25
YTB1siJqmi0,Il commento di Stefano Massini sullo scontro Trump - Zelensky,La7 Attualità,9812,80,43,1.7166666666666666,7,50.0,7.142857142857143,2025-03-09 22:42:29
YUYXg2DPaCk,"After Zelensky, Trump Blasts Irish PM In Oval Office | GRAVITAS Shorts",WION,20820,313,27,0.9333333333333333,3,26.0,8.666666666666666,2025-03-13 17:46:45
YW_k5h6V3Fc,“Fue una falta de respeto”: Ruiz-Healy sobre pelea de Trump y Zelenski,Grupo Fórmula,1578736,38447,11315,8.466666666666667,139,9473.0,68.15107913669065,2025-02-28 22:24:13
YYez-MZ5KAo,Is Donald Trump Trying to Oust Zelensky From Power? | Ukraine War | Vantage with Palki Sharma | N18G,Firstpost,143121,1901,398,8.366666666666667,27,957.0,35.44444444444444,2025-03-06 17:04:06
YamLmwxaOX8,DONALD TRUMP CHỬI ZELENSKY &quot;KẺ ĐÀO MỎ&quot; - MEDVEDEV NÓI ĐÚNG 1 CÂU KHIẾN PHƯƠNG TÂY ĐIẾNG NGƯỜI,BATTLECRY - KHÁM PHÁ,83230,1297,198,14.45,10,141.0,14.1,2025-05-20 04:15:06
Ye1IWSL4jL4,"LIVE: Trump, Zelensky meet at White House | FOX 7 NEWS",FOX 7 Austin,75057,567,209,215.68333333333334,31,385.0,12.419354838709678,2025-02-28 19:35:48
YirKr5oF19U,"মুখোমুখি ট্রাম্প-জেলেনস্কি, কী নিয়ে এমন উত্তেজনা? বাংলায় দেখুন | Zelensky | Trump | BanglaVision",BVNEWS24,3078407,54222,2474,5.866666666666666,114,15266.0,133.91228070175438,2025-03-01 08:55:51
YkUMMHGTnX4,Zelensky&#39;s Shopping Nightmare – Trump &amp; Kim Can&#39;t Stop Laughing!,Hatims Shorts,569891,0,532,1.0,83,2436.0,29.349397590361445,2025-03-18 14:34:16
YlkgCyL8R_0,Trump - Zelenski Görüşmesinde Kavga! Trump Zelenski&#39;yi Beyaz Saray&#39;dan Kovdu,Habertürk TV,96602,228,105,3.1166666666666667,16,211.0,13.1875,2025-03-01 12:30:27
Yulft_1V668,"Congress: Trump&#39;s 1st Reaction To Zelensky Apology Letter; Says This About Putin…| Ukraine,Russia,US",Hindustan Times,256807,1926,1074,3.5833333333333335,80,2903.0,36.2875,2025-03-05 04:50:32
Z64gekJD4fU,"Scontro con Trump, Zelensky su Fox News torna a chiedere le garanzie di sicurezza",euronews (in Italiano),11564,68,87,1.1833333333333333,9,112.0,12.444444444444445,2025-03-01 10:57:43
Z6giVYxtRV0,ÚLTIMA HORA: Zelensky pide perdón a Trump por faltarle al respeto durante su visita a la Casa Blanca,Negocios TV,45238,937,287,1.9166666666666667,48,985.0,20.520833333333332,2025-03-10 20:13:06
