video_id,video_title,channel_title,view_count,like_count,total_comments,duration_minutes,comments_collected,total_comment_likes,avg_comment_likes,published_at
ZE7qCkYbCbg,Zelensky Leaves White House after Argument with Trump &amp; Vance - LIVE Breaking News Coverage (Part 1),Agenda-Free TV,225697,3680,313,107.33333333333333,99,2530.0,25.555555555555557,2025-02-28 18:58:01
ZFrHfZR5Kx0,"No Compromise With &#39;killer Putin&#39;, Zelensky Tells Donald Trump At White House | World News | WION",WION,31460,499,272,8.616666666666667,31,504.0,16.258064516129032,2025-03-01 02:34:14
ZThLlfMvMRY,Chris Hayes: Trump ‘irreparably destroyed’ world order with Zelenskyy blowup,MSNBC,3872455,85855,37066,14.383333333333333,259,279277.0,1078.2895752895754,2025-03-01 01:55:09
Z_NNL9Dmq7I,zelensky hit trump#zelensky #trump,News wale,3935,81,12,0.08333333333333333,0,0.0,,2025-03-03 06:37:16
ZdfHVY4xhS4,Ukraine war: Lessons for South Korea? [The GeoVista] #Zelensky #Trump #KimJungUn,Arirang TV,357,4,0,0.75,0,0.0,,2025-04-02 22:00:38
ZhafNebpipo,Insensitive doesn’t begin to describe this… #zelensky #trump,Don Lemon,209301,23919,3888,0.5,175,24062.0,137.49714285714285,2025-02-28 18:51:15
Zn5vQQStYPw,Perché lo SCONTRO tra TRUMP e ZELENSKY è la fine della diplomazia,La Stampa,45724,395,94,1.6333333333333333,17,245.0,14.411764705882353,2025-02-28 20:00:54
Zn9BTALjtLY,&#39;Who&#39;s that good for?&#39;: Maddow connects the dots on Donald Trump&#39;s behavior toward Russia,MSNBC,2269881,59152,11444,12.233333333333333,215,78598.0,365.57209302325583,2025-03-01 05:30:15
Zt2RF-38plY,"Trump, Vance maken ruzie met Zelensky, wat was daar aan de hand?",VRT NWS,171883,1635,2448,11.033333333333333,203,6851.0,33.748768472906406,2025-02-28 20:02:27
ZuxyPUx-dfA,La risposta di Zelensky a Trump dopo il duro incontro con il Presidente USA,TG La7,242733,3025,468,1.4,67,1678.0,25.044776119402986,2025-02-28 19:44:32
_6KiEAdLMTc,Rencontre Zelensky - Trump : Qui est le bon ? Qui est le méchant ?,Union Populaire Républicaine,772955,36782,7574,63.416666666666664,155,22268.0,143.66451612903225,2025-03-02 09:48:05
_E-L8VelWWE,Desperate Zelensky &quot;Ready&quot; to Appease Trump | Firstpost America | N18G,Firstpost,5414,149,3,0.8833333333333333,0,0.0,,2025-03-03 17:56:16
_GhfRHSONYU,Trump vs Zelenskyy | don’t tell us how to feel! 🙏😳 #politics #trump #shortsvideo #maga,Donkey on democrats ,521,14,2,2.95,0,0.0,,2025-03-04 13:47:42
_IcMkGBioFA,Ông Trump: Mọi thứ ông Zelensky nói ra đều gây ra vấn đề | Thời sự quốc tế,Báo Pháp Luật TP HCM,1566,7,2,8.4,0,0.0,,2025-05-27 02:30:06
_MHxIpCLKK4,"Chiến Sự Nga - Ukraine: Trump đã “tha lỗi”cho ông Zelensky, cái“gật đầu” khiến cả nước Ukraine vỡ òa",BẢN TIN CHIẾN SỰ MỚI NHẤT,86,3,0,21.066666666666666,0,0.0,,2025-03-07 17:00:45
_OMpEASjzgY,"Malah Pakai Kaus, Trump Beri Sindiran Pedas Gaya Pakaian Zelensky saat Datangi Gedung Putih",Tribun Jateng,2239,33,0,0.8166666666666667,0,0.0,,2025-03-03 02:39:18
_g0Mbws7hew,ZELENSKY shocks TRUMP with disturbing photos of UKRAINIAN prisoners of war,Diario AS,17550,64,74,2.0,8,105.0,13.125,2025-02-28 19:50:45
_hx_C4ZsUVI,Putin&#39;s Big Statement After &#39;Historic&#39; Zelensky-Trump Showdown At White House | Watch,Times Of India,1034501,15370,5628,4.666666666666667,245,34860.0,142.28571428571428,2025-03-01 02:21:53
_lPtddWqKNI,Zelensky&#39;s U-turn After Trump Clash: Ready for White House Return | Vantage with Palki Sharma | N18G,Firstpost,1343298,37283,1473,1.2,63,2901.0,46.04761904761905,2025-03-03 17:40:04
_oNnS4lfeMo,Ukraine and European allies are the losers from Oval Office bust-up | Analysis,Sky News,306156,2662,3117,5.45,153,5779.0,37.77124183006536,2025-02-28 21:09:13
a-qPKax7oY8,Pleito Zelensky-Trump puede provocar que Estados Unidos se aleje de Europa: Horacio Besson,MILENIO,17417,202,54,7.1,6,48.0,8.0,2025-03-01 03:33:44
a7ziSd1QFrg,"BREAKING: Zelensky Details Steps After Trump Pulls US Aid, Expresses &#39;Regret&#39; Over Oval Office Clash",Forbes Breaking News,563563,6939,4202,3.8666666666666667,143,10650.0,74.47552447552448,2025-03-04 21:12:25
aCLgNtZe3Ww,LIVE | Trump Asks Zelensky To Shut Up! ‘This War Would Be Over in 2 Weeks’ | Shocking Clash,Oneindia News,15306,80,59,4.2,9,82.0,9.11111111111111,2025-02-28 19:25:06
ajxSWocbye8,"President Trump and Ukrainian President Zelenskyy in Oval Office, Feb. 28, 2025",The White House,1018226,10559,0,49.36666666666667,0,0.0,,2025-02-28 22:04:53
akx8v_xj1BA,Rencontre Zelensky - Trump lors des funérailles du Pape François.,Brut,163081,1735,313,0.43333333333333335,53,1012.0,19.09433962264151,2025-04-26 13:13:51
atYY_7zCRUg,Bridging Ukraine peace talks? [The GeoVista] #Zelensky #Trump #Putin,Arirang TV,789,6,0,0.9333333333333333,0,0.0,,2025-04-02 09:00:05
au5wYYPREc4,"Trump - Zelensky, full 50-minute conversation I MARCA",MARCA,84966,731,325,49.36666666666667,68,1167.0,17.16176470588235,2025-03-01 09:46:47
b3j448OLRzg,"After Zelensky, Trump Blasts Irish PM In Oval Office | GRAVITAS",WION,21124,114,67,3.9166666666666665,5,65.0,13.0,2025-03-13 17:13:45
b4VsComSVSA,Zelenskyy signs deal with UK amid fallout from Trump meeting | ABC NEWS,ABC News (Australia),210252,3325,0,4.95,0,0.0,,2025-03-02 08:30:04
bG54n6t9dSg,Trump accuses Zelensky of not wanting ceasefire,Daily Mail World,23302,808,91,1.1833333333333333,20,250.0,12.5,2025-02-28 20:54:55
bVFPBTOMt3g,"Weekend Update: Trump Scolds Ukraine President Zelenskyy, Kisses Elon Musk&#39;s Feet in AI Video - SNL",Saturday Night Live,4254766,67190,3220,4.366666666666666,208,41135.0,197.76442307692307,2025-03-02 06:48:54
bYwuZQcXRR0,Trump vs Zelensky Fight | The End of Ukraine? | Dhruv Rathee,Dhruv Rathee,11781414,439816,25365,22.183333333333334,144,49020.0,340.4166666666667,2025-03-06 17:09:54
bedOHv22MGg,WATCH: Trump Lashes Out at Zelensky &quot;Your Country is in Big Trouble. You&#39;re Not Winning...&quot; | N18G,CNBC-TV18,30699,401,224,3.0166666666666666,38,501.0,13.18421052631579,2025-02-28 19:34:10
boZ13zjH4J0,Dit was de volledige ruzie tussen Trump en Zelensky,RTL Nieuws,288400,1729,1618,10.466666666666667,177,9779.0,55.24858757062147,2025-03-01 10:20:10
c2si1P19IiY,Clash Trump-Zelensky : les alliés de l&#39;Ukraine font bloc • FRANCE 24,FRANCE 24,139668,940,781,1.5166666666666666,98,2336.0,23.836734693877553,2025-03-01 09:24:08
c4hD_S63Xkg,Zelensky Trump Fight #shorts #shortvideo #zelensky #trump #fight #news #ukraine #news #putin #best,Den Sep,9407,115,17,0.2,0,0.0,,2025-03-01 17:42:07
c5HuzBVIf3w,Trump renews attack on Zelensky and demands deal to end Ukraine war | BBC News,BBC News,1118944,9510,8347,12.4,179,15189.0,84.85474860335195,2025-03-03 23:32:04
c5eEIG8pQzQ,TRUMP - ZELENSKI: Así han REACCIONADO el mundo a la DISCUSIÓN vista en la CASA BLANCA | RTVE,RTVE Noticias,699112,6147,4242,1.2166666666666666,157,8872.0,56.50955414012739,2025-02-28 20:28:58
c7BHwetZRIc,ক্ষমা চেয়ে জেলেনস্কির চিঠিএখন ট্রাম্পের টেবিলে #zelensky #Trump #shortvideo,Rtv News,20203,450,2,0.6833333333333333,0,0.0,,2025-03-13 06:21:41
cIZGyBcC4kg,Zelensky face à Trump : le clash｜TF1 INFO,TF1 INFO,980166,9757,3991,4.133333333333334,187,16037.0,85.75935828877006,2025-02-28 20:00:22
cJDDsebA8V8,"Trump está fazendo coerção com Zelensky, diz ex-embaixatriz ucraniana no Brasil",UOL,36339,1322,512,7.216666666666667,56,1064.0,19.0,2025-02-28 21:51:35
cYfqDPhOX-Q,"In Fight With Zelensky, Trump Has Given Putin Green Light For U.S. Support",Katie Couric,25253,398,174,1.8666666666666667,15,214.0,14.266666666666667,2025-02-28 21:03:41
cZwGU6zlHkA,Ontmoeting Trump en Zelensky ontaardt in felle ruzie: &#39;U bent respectloos&#39;,NOS,188251,837,1903,1.9166666666666667,180,7782.0,43.233333333333334,2025-02-28 18:53:50
clx0PSUi8yk,"Zelensky, Trump, Vance have heated exchange in Oval Office",WBFF FOX45 Baltimore,21117,267,117,0.26666666666666666,18,333.0,18.5,2025-02-28 19:49:44
d-TreRYWpgM,J’ai interrogé Trump et Macron sur le choc mondial qui cible l’Europe,HugoDécrypte - Grands formats,1873132,44686,5763,29.166666666666668,205,30276.0,147.68780487804878,2025-03-01 01:55:12
d1-bnv0YWbc,Rubio points finger at Zelensky for breakdown of Trump meeting,CNN,1199940,12212,24025,10.116666666666667,242,67591.0,279.301652892562,2025-03-01 02:35:45
d8HNq8N8hkQ,Shopping Chaos: Kim Jong Un Snaps on Trump &amp; Melania!,Hatims Shorts,2608295,41493,963,1.0,84,2777.0,33.05952380952381,2025-04-21 16:29:17
dAP8qNXHuig,"TIN NÓNG! Zelensky - Trump giảng hòa, hợp đồng khoáng sản sẽ được ký ngay hôm nay!?",BẢN TIN CHIẾN SỰ MỚI NHẤT,780,14,0,18.533333333333335,0,0.0,,2025-03-06 14:00:47
dHvP6rbRxdM,"‘Putin Will Bomb...’: Zelensky Warns of World War, Urges Trump to Visit Sumy in 60 Minutes Interview",Times Of India,17292,215,271,5.433333333333334,28,592.0,21.142857142857142,2025-04-14 12:59:56
dZJYNVmrLDY,"Keir Starmer Calls Trump-Zelensky Clash &quot;Uncomfortable,&quot; Stresses Need For Peace | WION Shorts",WION,3416,55,4,0.65,0,0.0,,2025-03-02 14:21:24
dim_g_kctT8,Trump-Zelensky Meet Row | People React With Tears And Shock In Ukraine | WION,WION,88522,554,363,2.55,35,995.0,28.428571428571427,2025-03-02 06:40:29
djKsi7c-s9g,Trump vs Zelensky Big Clash Inside Story - | Geo News,Geo News,208539,4686,16,0.75,1,5.0,5.0,2025-03-01 17:59:32
djxTj324z4g,Trump sospende gli aiuti all&#39;Ucraina dopo lo scontro con Zelensky,euronews (in Italiano),132648,2334,699,0.4,81,1438.0,17.753086419753085,2025-03-04 11:49:13
dnodmN0MAfY,Shocked Ukrainians react to bombastic Trump-Zelenskyy meeting,CBS News,704875,10603,8248,8.05,197,14906.0,75.66497461928934,2025-02-28 20:04:24
dpyPVvuitkw,Trump and Vance Berate Zelensky,The New York Times,25594,619,245,2.7666666666666666,53,1694.0,31.962264150943398,2025-03-01 02:17:00
dqfMDqQPzpQ,Trump Zelensky: ट्रंप और ज़ेलेंस्की बैठक में बहस के बाद क्या बोले? (BBC Hindi),BBC News Hindi,264699,0,409,3.15,40,1246.0,31.15,2025-03-01 09:25:04
e2YW726uDOE,Scontro Trump-Zelensky: Il presidente ucraino salta la conferenza stampa,TG La7,591286,3786,3238,4.433333333333334,138,7778.0,56.36231884057971,2025-02-28 19:17:03
e4aPkOULc34,TRUMP E ZELENSKY (DUBLADO EM PORTUGUÊS!),GCoelho,3874489,156370,20161,9.916666666666666,245,82356.0,336.1469387755102,2025-03-01 02:30:32
eazqDdpsK8s,Trump and Zelenskyy play cards in the Oval Office | This Hour Has 22 Minutes,22 Minutes,3510039,74578,7135,2.5166666666666666,193,54610.0,282.95336787564764,2025-03-04 18:46:20
eh3d8ASR-80,Zelensky addresses clothing,Daily Mail World,3999785,87110,10839,0.9,268,81115.0,302.6679104477612,2025-02-28 20:05:52
ejiue5wwFaE,Donald Trump &amp; Macron vs Zelensky 😳🔥 #donaldtrump #macron #zelensky #trump #trumpnews #whitehouse,Fatmir Sufa,1008277,10126,638,0.5,41,1086.0,26.48780487804878,2025-04-26 17:55:35
enil6bK9g0Y,"Trump, Zelenskyy and Starmer join world leaders at Pope Francis&#39;s funeral",Sky News,251868,1229,532,10.333333333333334,91,1912.0,21.01098901098901,2025-04-26 08:11:58
euqEnNlgc48,Armes US : Zelensky cède face à Trump ｜LCI,LCI,422444,3483,2461,25.066666666666666,115,4413.0,38.37391304347826,2025-03-05 08:00:40
ex9ZNqkPprM,Trump&#39;s Zelensky meeting body language decoded and secret &#39;touching&#39; moments with Melania,The Sun,97553,1292,534,9.766666666666667,39,827.0,21.205128205128204,2025-04-27 12:01:09
eyx9fTPl7ZM,Lula comenta encontro entre Trump e Zelensky no funeral do papa #shorts,Band Jornalismo,47789,450,72,0.5666666666666667,9,117.0,13.0,2025-04-26 13:33:39
f1HQQP9mUF8,"News Today: Measles outbreak update, White House press, Zelenskyy Trump meeting,",LiveNOW from FOX,1085549,9032,282,252.43333333333334,38,642.0,16.894736842105264,2025-02-28 22:22:40
f7bsYTSNb0U,"US &#39;Problems Get Worse&#39; if Russia Wins: Career Diplomat Reacts to Trump, Zelenskiy Blowup",Bloomberg Podcasts,873360,11349,4929,8.8,215,24003.0,111.64186046511628,2025-02-28 21:13:20
fENhJvwCHrg,Trump and Zelensky clash in Oval Office shouting match,INQUIRER.net,87120,663,662,5.016666666666667,86,1462.0,17.0,2025-03-01 03:06:51
fJdOJJyYZsc,"Zelensky Trump Fight | This Triggered Trump-Zelensky Clash, Then Team Ukraine Was Asked To Leave",NDTV,119717,523,253,1.3166666666666667,52,1394.0,26.807692307692307,2025-03-01 08:43:18
fYSb2VJHHBk,Das Wortgefecht zwischen Trump und Selenskyj im Video | DER SPIEGEL,DER SPIEGEL,369541,3106,4476,2.25,180,17293.0,96.07222222222222,2025-02-28 21:11:35
fqh_5RdJOLs,"Trump vire Zelensky, l&#39;Europe riposte avec un plan, explications",HugoDécrypte - Actus du jour,634093,14775,1528,10.066666666666666,123,3937.0,32.00813008130081,2025-03-03 19:00:34
fuShlpGdxvY,La sfuriata di Trump contro Zelensky davanti a tutti i giornalisti - SOTTOTITOLI,Vista Agenzia Televisiva Nazionale,38882,171,138,4.85,19,256.0,13.473684210526315,2025-02-28 20:19:17
fzJMX7JXPB0,Wait For End | PeaceMaker #respect #trump #zelensky #putin #sigma,Hindutva Shorts,50958,1568,47,0.7333333333333333,9,118.0,13.11111111111111,2025-03-04 14:39:35
g2AYoPaRVuU,États-Unis : démocrates sidérés et républicains solidaires de Trump après le clash avec Zelensky,FRANCE 24,300232,2109,1661,2.1333333333333333,160,4613.0,28.83125,2025-03-01 07:46:28
g4vXRTYELGs,La rencontre entre Donald Trump et Volodymyr Zelensky tourne à l&#39;affrontement,Radio-Canada Info,963171,0,4813,18.9,135,6657.0,49.31111111111111,2025-02-28 22:31:37
gEoUktvoyEs,Who’s At Fault? | Was Zelensky &#39;Ambushed&#39; By Trump &amp; Vance? | Should India Worry? | Akash Banerjee,The Deshbhakt,2131217,59394,7305,21.0,190,24308.0,127.93684210526315,2025-03-01 17:17:42
gIPzuYYFqWQ,Trump et Zelensky viennent-ils de piéger Poutine ?｜LCI,LCI,116571,1234,880,15.033333333333333,53,996.0,18.79245283018868,2025-05-14 05:00:43
gZdWWDAX4Is,"Trump - Zelensky Spat: World Leaders React, Europe Sides With Ukraine, POTUS Slammed, Who Said What?",MIRROR NOW,19926,151,153,4.833333333333333,16,113.0,7.0625,2025-03-01 12:28:20
gdWipW5Ahgs,[FULL Tiếng Việt] Màn tranh cãi cực gắt giữa ông Zelensky và ông Trump | Phần 1,HTV - Đài Hà Nội,447337,3764,81,22.75,46,2222.0,48.30434782608695,2025-03-01 09:46:00
grDtcPO-n8Q,TRANH LUẬN NẢY LỬA GIỮA ÔNG TRUMP VÀ ÔNG ZELENSKY TẠI NHÀ TRẮNG,BBC News Tiếng Việt,129122,1607,670,1.4666666666666666,77,1553.0,20.16883116883117,2025-03-01 03:52:41
grTdkBGnOm0,UK PM Starmer Commented On The Fierce Debate Between Zelensky-Trump At The Oval | WION Shorts,WION,16344,240,45,0.6,1,6.0,6.0,2025-03-02 19:21:04
gv6Y18qhwXE,&quot;إهانات في البيت الأبيض&quot;.. شاهد معركة كلامية بين ترامب وزيلينسكي أمام الكاميرات,CNNArabic,1623556,12442,4112,4.8,148,16044.0,108.4054054054054,2025-02-28 19:40:00
gvlYGgWGc5Y,"World leaders react to Trump, Zelensky dispute",FOX 4 Dallas-Fort Worth,79698,469,779,2.05,82,1454.0,17.73170731707317,2025-03-02 04:48:10
gyat13HuyJs,"Zelensky diz que apoio de Trump é essencial, mas quer garantias para fechar acordo #g1 #notícias",g1,16640,939,16,0.75,1,6.0,6.0,2025-03-01 00:34:08
h3WD9CUNgEE,"Trump, Vance spar with Zelenskyy in heated meeting: &#39;Gambling with World War III&#39;",Fox News,1944203,31362,15102,49.85,233,31946.0,137.10729613733906,2025-02-28 19:22:49
h5S56mdLdHs,Trump details letter from Zelensky,CNN,66157,860,350,1.0333333333333334,33,944.0,28.606060606060606,2025-03-05 04:33:01
hFieB6gM31A,🇺🇸 🇺🇦  D. Trump et V. Zelensky se rencontrent en marge des obsèques du pape François,FRANCE 24,22846,241,14,0.95,1,5.0,5.0,2025-04-26 10:57:16
hN8X6vFXUbs,Advantage Putin? US Gives First Aid Shock To Ukraine Amid Zelensky-Trump Fallout After Ugly Clash?,Hindustan Times,9874,410,27,3.716666666666667,5,45.0,9.0,2025-03-01 14:09:13
he486nK2e_M,&#39;JD Vance is a piece of sh*t&#39; | Adam Boulton tears into Trump&#39;s explosive row with Zelensky,Times Radio,2957148,82146,30991,20.833333333333332,302,178241.0,590.2019867549669,2025-02-28 19:45:02
hi7_Xy7DSmw,De band tussen #Zelensky🇺🇦 en #Trump🇺🇸 herstellen? Deze oud-topdiplomaat ziet nog mogelijkheden,EenVandaag,1937,22,2,0.95,0,0.0,,2025-03-10 16:50:00
hlcIfe7jg7Y,"Zelensky Asked Point Blank, &#39;Why Don&#39;t You Wear A Suit?&#39; In Oval Office Meeting With Trump",Forbes Breaking News,2623481,15217,13717,2.0166666666666666,325,119688.0,368.27076923076925,2025-02-28 22:00:30
hp-mgT_e4WU,Former US Ambassador Chas Freeman on the TRUMP ZELENSKY MEETING,India & Global Left,18531,323,18,0.6666666666666666,0,0.0,,2025-03-02 16:01:08
hs_0we4LbPY,Donald Trump and Zelensky on Meme meeting 🥺 #SUBSCRIBE 🥺🙏,The News guy 69,7379,39,0,0.1,0,0.0,,2025-03-03 13:28:26
i1JUMoUOlk8,Ruzie Trump en Zelensky: &#39;Nooit eerder vertoond&#39;,Nieuwsuur,29482,441,182,2.3333333333333335,19,544.0,28.63157894736842,2025-02-28 22:48:15
iNK7HdHfldQ,Ông Trump và Zelensky lớn tiếng cãi vã ngay tại phòng Bầu dục | Báo Điện tử VOV,Báo Điện tử Tiếng nói Việt Nam (VOV),45962,890,0,2.35,0,0.0,,2025-03-01 00:30:21
iPOrKKIh53E,Trump &#39;kicked Zelenskyy out of the White House&#39; after Oval Office bust-up,Sky News,1554492,10913,8809,2.75,165,35582.0,215.64848484848486,2025-02-28 19:36:43
iSW8ezOmYHs,Maddow: Two new details learned from Trump&#39;s Oval Office meltdown,MSNBC,2687510,80361,18133,5.283333333333333,259,146626.0,566.1235521235521,2025-03-01 06:33:30
iSYIR8IfudE,Perché Trump ha aggredito Zelensky: l&#39;analisi dettagliata del video dell&#39;incontro,Roberto Saviano Official,1025971,36940,10190,28.5,117,5714.0,48.837606837606835,2025-03-02 15:45:06
ij2_tkROOQ4,Trump’s explosive screaming match with Zelensky sparks deep Republican rift,Times Radio,229811,5335,2512,9.583333333333334,190,20260.0,106.63157894736842,2025-03-01 08:03:36
j31fRGlVqYQ,Donald Trump &amp; Macron vs Zelensky 😳😳 #donaldtrump #macron #zelensky #trumpnews #trump #trumpfamily,Fatmir Sufa,5798184,46514,2781,0.43333333333333335,120,6807.0,56.725,2025-04-04 15:01:45
j6x1thSxBxU,Lo scontro tra Donald Trump e Volodymyr Zelensky nello Studio Ovale della Casa Bianca,RaiNews,680056,7638,5776,8.816666666666666,189,12034.0,63.67195767195767,2025-02-28 19:51:55
jg5tI8tF-Jw,Trump Zelensky के बीच हुई बहस के बाद वोलोदिमीर ज़ेलेंस्की क्या करेंगे? (BBC Hindi),BBC News Hindi,337806,0,443,3.95,25,506.0,20.24,2025-03-02 02:30:29
kEOv4x_FIsc,Watch Trump and Zelenskyy&#39;s full remarks during White House meeting,NBC News,893247,4698,4571,49.8,200,19518.0,97.59,2025-02-28 21:58:08
kKTKB4FsZ-g,A teljes Trump-Zelenszkij botrány szinkronnal: 50 perc dráma és kiabálás a Fehér Házban,Hetek,188892,4993,1139,49.71666666666667,153,6178.0,40.37908496732026,2025-03-01 06:00:06
kSGp0yNo-xg,Clash historique entre Donald Trump et Volodymyr Zelensky｜TF1 INFO,TF1 INFO,525494,14848,365,2.6,58,1122.0,19.344827586206897,2025-03-01 13:57:20
ka9asqb9Bt8,अब Ukraine का क्या होगा? Ukraine War Update #ukrainerussiawar #zelensky #trump,The Study IAS By Manikant Singh,9806,529,6,0.6166666666666667,0,0.0,,2025-03-05 15:01:03
kaFGrt-cgro,"Trump-Zelensky, cosa pensano gli ucraini dopo lo scontro in tv",Il Messaggero,391636,3762,3382,2.066666666666667,157,7657.0,48.77070063694268,2025-03-01 11:30:50
keT7wK9jLDc,Zelensky Sends Letter To Trump after Oval Office Showdown | N18G,Firstpost,4444,106,4,0.5833333333333334,0,0.0,,2025-03-05 17:46:25
kha9dC1Fvcg,特朗普與澤連斯基激烈爭吵  白宮會談不歡而散－ BBC News 中文,BBC News 中文,3322011,35101,25400,4.9,335,176704.0,527.4746268656717,2025-02-28 23:29:51
kl9Kzfo6ioo,Adu mulut panas antara Trump dan Zelensky,Antara TV Indonesia,12338,252,18,0.9,0,0.0,,2025-03-01 14:30:23
ktZXCPXxtzY,Lý Do Tỷ Lệ Ủng Hộ Ông Zelensky Tăng Sau Màn Tranh Cãi Với Ông Trump #zelensky #trump,Truyền hình Hưng Yên - HYTV,3880,29,0,0.7666666666666667,0,0.0,,2025-03-25 04:10:40
kvf-mqavPLw,Así fue la acalorada discusión entre Trump y Zelenski sobre la guerra en Ucrania • FRANCE 24,FRANCE 24 Español,1688986,21333,9275,6.983333333333333,245,42568.0,173.74693877551022,2025-02-28 18:53:45
kvhXv_cASVg,Trump SNAPS at Zelensky and threatens WWIII,Allan Lichtman,9414,952,135,1.25,26,570.0,21.923076923076923,2025-02-28 20:45:02
kxy9_6N4QAc,Rencontre entre Trump et Zelensky : décryptage et conséquences d&#39;un clash historique ｜TF1 INFO,TF1 INFO,555217,4431,1802,5.883333333333334,163,5962.0,36.576687116564415,2025-03-01 14:01:00
l1nEGOyBymc,ଆମେରିକାର ହ୍ବାଇଟ ହାଉସରେ ହାଇଡ୍ରାମା | Russia Ukraine War | Zelensky Trump Argument | White House | N18G,News18 Odia,9833,120,0,0.9666666666666667,0,0.0,,2025-03-01 13:50:31
l70qUYUH7sI,Vindman on Zelensky clash: JD Vance wasn&#39;t ready for the &#39;big boy table&#39;,CNN,935107,10383,9955,8.65,201,34504.0,171.66169154228857,2025-03-01 12:30:48
lIFGeG-Jglc,GUERRA UCRANIA: TRUMP Y ZELENSKI MANTIENEN UNA REUNIÓN &quot;MUY CONSTRUCTIVA&quot; en el VATICANO | RTVE,RTVE Noticias,44746,595,241,2.6666666666666665,23,376.0,16.347826086956523,2025-04-26 11:56:37
lVOQE64MCMU,PANAS!!! Donald Trump Tegur Keras Zelensky di Gedung Putih - [Metro Siang],METRO TV ,108120,966,817,3.9,56,1495.0,26.696428571428573,2025-03-01 06:24:47
lW0fG2qB5-4,Zelensky&#39;s suit &#39;swipe&#39; at Trump gets laughs &amp; applause,The Sun,67687,797,389,2.4833333333333334,43,1086.0,25.25581395348837,2025-03-11 12:45:13
lcUPnIsC_pI,Trump Vs Zelensky ruined by Ai,World Luxury,700891,9618,656,1.3,37,2815.0,76.08108108108108,2025-03-05 16:09:34
lfYSotIUcHU,DONALD TRUMP IS ANGRY 😡 WITH ZELENSKY 🥺 #SUBSCRIBE 🥺🙏,The News guy 69,1924,12,0,0.1,0,0.0,,2025-03-04 06:38:35
lyLlnThntG4,Russia ‘laughing’ about White House exchange between Trump and Zelensky,Sky News Australia,63730,465,622,5.616666666666666,70,1867.0,26.67142857142857,2025-03-03 06:36:40
lylJMPBQWkc,UK PM’s Comforting Words Make Zelensky Emotional After Disastrous Trump Meet? ‘As Long As It Takes’,Hindustan Times,127326,2124,1231,3.283333333333333,138,5110.0,37.028985507246375,2025-03-01 18:48:50
lzBAH1lQQe8,Trump jokes he&#39;s better than George Washington,Daily Mail World,14900,273,19,0.4166666666666667,0,0.0,,2025-02-28 18:51:27
m_t-on52cso,"Russia Wastes No Time, Issues Big Statement After Trump Shuts Down Zelensky in Unprecedented Clash",Hindustan Times,106459,1494,472,5.066666666666666,73,2170.0,29.726027397260275,2025-03-01 05:17:08
n0DvLhuXzSA,Zelensky Suit Question | Zelensky Was Asked Why He&#39;s Not Wearing Suit. His Reply | Trump Zelensky,NDTV,389890,5570,786,0.6,80,3744.0,46.8,2025-03-01 17:41:37
n214S56T540,Trump&#39;s Biggest Revenge On Europe For Backing Zelensky After Spat? US To Exit NATO? Elon Musk Hints…,Hindustan Times,387387,3696,1870,6.35,135,8447.0,62.57037037037037,2025-03-02 13:00:57
n6oXLi1Be7U,Les Ukrainiens inquiets après l&#39;altercation entre Donald Trump et Volodymyr Zelensky,Radio-Canada Info,61613,0,326,3.0,45,1073.0,23.844444444444445,2025-03-03 13:10:00
n9r5yfM_PPU,Une scène d’une tension inouïe entre Donald Trump et Volodymyr Zelensky,Le Monde,286614,3700,698,1.8333333333333333,98,3640.0,37.142857142857146,2025-02-28 19:27:31
nJQgroLKfoQ,Трамп и Зеленский поругались в Белом доме [ русский перевод ],AKIpress news,4713078,42490,19225,10.766666666666667,290,86657.0,298.81724137931036,2025-03-01 05:00:12
nOXMbwdm75I,Trump Mocks Zelensky After Putin Says ‘Yes’ To Ceasefire Offer: ‘You Don’t Pick Fight With…’ |Russia,Hindustan Times,363037,4531,1978,11.0,164,4751.0,28.96951219512195,2025-03-15 09:01:21
nQFFeBRBwQA,LIVE: Nach Streit zwischen Trump und Selenskyj,tagesschau,529067,3187,0,42.5,0,0.0,,2025-02-28 21:00:27
nmKbb8RC4Tw,&quot;You&#39;ve done a Lot of Talking&quot;: Trump Shouts at Zelensky in White House | Subscribe to Firstpost,Firstpost,5210426,101464,5116,0.8166666666666667,158,27388.0,173.34177215189874,2025-03-01 08:29:34
o7P9rquwa3Y,La disastrosa situazione tra Zelensky e Trump… cosa ci aspetta?,Breaking Italy,216403,16886,1317,22.583333333333332,160,8279.0,51.74375,2025-03-03 18:06:36
oEBmoTxlmZc,See powerful moment President Trump met President Zelensky in the Vatican,CNN,790867,9056,5625,10.15,174,10888.0,62.57471264367816,2025-04-26 15:26:28
oIoQeAPPEI8,"Trump tem duas grandes mágoas e não gosta de Zelensky em termos pessoais, destaca professor",UOL,142956,5021,845,15.466666666666667,105,3212.0,30.590476190476192,2025-02-28 22:15:07
oWPSxwM4qao,trump zelensky meeting | Russia Reaction | pak media on india latest,India Web News,7548,133,8,12.766666666666667,0,0.0,,2025-03-01 15:16:06
obKiJkNUTJ0,"Zelensky Calls for &#39;Real Peace&#39; After Trump Clash, Ready for Minerals Deal | WION Shorts",WION,3305,67,11,0.5333333333333333,0,0.0,,2025-03-01 13:15:49
odFTqgm0984,Volodymyr Zelenskyy: The 2025 60 Minutes Interview,60 Minutes,1245160,46501,11383,13.7,251,59241.0,236.0199203187251,2025-04-13 23:55:49
odP2Z_utr6o,Donald Trump unleashes on Zelensky for sabotaging peace talks with Russia,Sky News Australia,125837,3633,1863,5.616666666666666,141,6917.0,49.05673758865248,2025-04-24 03:39:10
p6kIQkkItGU,Trump Fist Fight Zelensky in Meeting❗❗ 😂... (AI Memes) Trump and Zelenskyy play cards #funnyshorts,Memes Nihhh,6391764,52798,1170,0.26666666666666666,43,1115.0,25.930232558139537,2025-03-06 00:30:25
pAk8RYJJuVw,Europe rallies behind Zelensky after furious White House exchange with Trump. #Ukraine #BBCNews,BBC News,143954,3781,1729,0.7666666666666667,125,4707.0,37.656,2025-03-01 10:02:52
pUlzSm-jeEY,U.S. President Trump Reads Out Zelensky&#39;s Letter Of Reconciliation During Congress Address | N18S,CNN-News18,4694,141,14,0.7833333333333333,3,22.0,7.333333333333333,2025-03-05 08:54:59
