video_id,video_title,channel_title,view_count,like_count,total_comments,duration_minutes,comments_collected,total_comment_likes,avg_comment_likes,published_at
pdXuVmAoruU,Trump&#39;s Disastrous Meeting with Zelenskyy; Graham&#39;s Brazen Ukraine Flip Flop: A Closer Look,Late Night with Seth Meyers,2803839,69428,7655,18.183333333333334,534,114570.0,214.5505617977528,2025-03-04 02:00:36
pwQLi4DKLl8,Trump vs Zelensky Guitar Battle (Fan Made Video Edit),NickSong,2096608,42527,3399,1.3666666666666667,130,15937.0,122.5923076923077,2025-03-01 17:00:06
qF7S_JT3osw,US President Donald Trump Reacts Post Shouting Match With Zelensky | Zelensky-Trump Fight | N18G,CNN-News18,27190,230,366,3.6666666666666665,48,622.0,12.958333333333334,2025-03-01 06:03:30
qGw-qSR4Zf0,NÓNG: Zelensky sẵn sàng gặp lại Trump tại Mỹ; Trump bác bỏ quan ngại thân thiết với Nga,BẢN TIN CHIẾN SỰ MỚI NHẤT,158,6,2,18.666666666666668,0,0.0,,2025-03-17 19:00:41
qKFQSwoC5rU,"Trump Zelensky Meeting: ऐसे भिड़े ट्रंप-ज़ेलेंस्की, कौन सी बात बनी वजह? | #shorts",News18 India,99266,2924,37,1.0,2,13.0,6.5,2025-03-01 06:16:22
qS-GB21RweQ,Trump - Zelensky Tartışması | Trump Tehdit Etti!,Muhammed İKİTEPE,366675,3824,910,57.916666666666664,49,1517.0,30.959183673469386,2025-03-01 09:38:58
qXaYwVJY5Zw,"Veja a íntegra da reunião entre Trump, Zelensky e Vance [Legendado]",Brasil Paralelo,132458,4814,639,46.36666666666667,116,3380.0,29.137931034482758,2025-03-01 10:00:56
qaxP99GqRs0,Peace Talks or Performance? Zelensky’s Trump Move Sparks Backlash | Times Now World,Times Now World,10889,217,109,5.05,19,251.0,13.210526315789474,2025-05-31 03:32:52
quC8wVD78Tw,యూరప్ దేశాలకు షాక్ ఇచ్చిన ట్రంప్..! #europe #trump #zelensky #ukraine #russia | Nationalist Hub,Nationalist Hub,23211,1482,9,0.6166666666666667,0,0.0,,2025-03-06 08:02:21
qx5JiBGBC98,Trump Oval Office Clash: Zelenskyy’s Bold Response vs. Ramaphosa’s Poised Dignity,The Financial Express,17689,157,91,3.05,14,156.0,11.142857142857142,2025-05-22 11:03:02
rKxmXqpA0EI,"Detik-detik Presiden Zelensky Cekcok dengan Donald Trump &amp; Vance, Berujung Diusir dari Gedung Putih",Tribunnews,995034,6270,3883,4.116666666666666,123,8934.0,72.63414634146342,2025-03-01 02:55:34
rfGdo_XzUh4,Incontro Zelensky-Trump: il presidente ucraino mostra foto di persone torturate dai russi #shorts,Corriere della Sera,5849,90,20,1.0,0,0.0,,2025-03-12 06:00:35
ripEkYUkFxg,Did Trump Call Biden &#39;Stupid&#39; During His Heated Exchange With Zelensky? #trump #shorts,Mojo Story,19025,235,54,0.38333333333333336,9,66.0,7.333333333333333,2025-02-28 20:55:52
ryCDaInMCPg,Trump echa a Zelensky de la casa blanca. #ucrania #zelensky #trump #eeuu,Diego Acuña,3879,488,69,1.05,8,53.0,6.625,2025-03-01 05:10:00
s-Sy8vzdcwk,Trump treasury secretary &#39;shocked&#39; by Zelenskyy&#39;s behavior,Fox News,488004,10792,6491,5.3,145,6903.0,47.60689655172414,2025-03-01 16:15:06
sAEHRUIyUQg,"Trump Says Zelensky Ready To Negotiate To End War With Russia, Sign Minerals Deal | WION Shorts",WION,10879,251,23,1.0,1,5.0,5.0,2025-03-05 05:10:26
sQGmr93VgvQ,Trump Briefs Zelensky After Call With Putin | Subscribe To Firstpost | N18G,Firstpost,11373,147,7,0.65,0,0.0,,2025-05-20 07:17:48
sc4hPWORGfM,SNL parodies Trump-Zelensky meeting,Washington Post,426566,5930,339,1.5666666666666667,46,2448.0,53.21739130434783,2025-03-02 17:18:01
sels9VYANbM,NATO Chief Abandons Zelensky After Trump Clash? Mark Rutte’s Stunning Advice To Ukraine President,Hindustan Times,414660,3206,1895,3.0,143,5894.0,41.21678321678322,2025-03-01 18:29:57
sez0GEvriL4,BRIGA DE ZELENSKY E TRUMP: QUAL O RESULTADO? | Professor HOC,Professor HOC,1039030,99304,10468,42.7,209,38477.0,184.10047846889952,2025-03-01 01:40:47
si6xVgbzPx8,Zelensky Challenges Both Trump &amp; Putin: Ukraine Will Not Stop | Military Analysis,EGM NEWS,459,52,4,20.883333333333333,0,0.0,,2025-03-03 20:00:29
siDLgWjq8Gk,Eklat im Weißen Haus: Trump und Selenskyj brechen Treffen ab,tagesschau,1063199,12034,0,4.866666666666666,0,0.0,,2025-02-28 19:14:31
t21OERWmxUY,NEW: Trump update on Zelenskyy meeting,LiveNOW from FOX,5303378,97716,33063,8.95,254,89503.0,352.37401574803147,2025-02-28 22:49:44
tUcx-oxxxhk,Tổng Thống Ukraine Tuyên Bố Không Từ Chức Sau Cuộc Gặp Với Tổng Thống Trump #zelensky #trump,Truyền hình Hưng Yên - HYTV,5910,44,0,0.7166666666666667,0,0.0,,2025-03-01 10:09:41
ti935xKYH-0,Zelensky speaks after Trump meeting,Asmongold TV  ,2329320,60044,32801,27.183333333333334,343,139769.0,407.48979591836735,2025-03-01 00:04:10
tiJxiNrwOUU,Trump vs Macron 🥵 pour vous qui a gagné ?,Parolitique ,46644,1199,59,0.8333333333333334,7,71.0,10.142857142857142,2025-05-27 14:28:48
toE95uFGY64,Trump: US won&#39;t &#39;put up’ with perceived resistance from Zelensky,CNN,237536,2731,4363,11.2,177,13782.0,77.86440677966101,2025-03-03 19:11:57
tpiX9m9bMkY,A Trump–Zelenszkij-találkozó legkeményebb pillanatai - magyar felirattal,444.hu,961221,9440,4686,7.566666666666666,303,50628.0,167.0891089108911,2025-02-28 20:42:49
tqzusXhHX20,Zelensky vs. Trump Fight: These Ai Videos Are Hilarious 😂 #trump #zelensky #shortvideo #shorts #fyp,Viral Echoes,6597,65,3,0.4166666666666667,0,0.0,,2025-03-09 20:25:44
tuq-xHb7zbE,Trump weighs in as Zelensky arrives in Saudi Arabia for peace talks,The Sun,82043,419,549,2.5166666666666666,61,794.0,13.01639344262295,2025-03-10 20:58:37
u-rAURtlwn0,Selenskyj vs. Trump: Eskalation im Weißen Haus! Und jetzt? | #analyse,MrWissen2go,1988562,63850,11312,13.283333333333333,257,100942.0,392.7704280155642,2025-03-01 12:46:49
uXe6B0E1fsk,"War Of Words Between Zelensky ,Trump |V6 Teenmaar",Teenmaar,9109,360,0,1.0833333333333333,0,0.0,,2025-03-02 04:45:06
u_4eRk-C5jI,Presidente Trump humilla a Zelensky en la Casa Blanca,Teletrece,201346,2359,1699,7.95,78,2517.0,32.26923076923077,2025-03-01 01:14:49
uaKbSyNxfJs,Marco Travaglio e il suo monologo sullo scontro tra Zelensky e Trump | Accordi e Disaccordi,NOVE,861255,18662,2874,23.833333333333332,112,3031.0,27.0625,2025-03-03 14:21:38
ufmj44_2bMI,&#39;It&#39;s Been Harder&#39; | Donald Trump Complains Volodymyr Zelensky Is Harder To Deal With Than Russia,The i Paper,5686,88,9,1.2333333333333334,2,21.0,10.5,2025-04-24 08:54:25
ufzcmjivwEg,"Mỹ ra tối hậu thư, đặt thời hạn 2 tuần cho Nga chấm dứt xung đột ở Ukraine",Báo Điện tử Tiếng nói Việt Nam (VOV),38233,129,0,0.5666666666666667,0,0.0,,2025-05-30 04:51:12
ut1diu7UDO8,ALTA TENSIÓN entre TRUMP vs ZELENSKY en su visita a la CASA BLANCA,Diario AS,81323,1057,113,0.38333333333333336,5,64.0,12.8,2025-02-28 20:14:23
uwouGMR1MgQ,Zelenskiy Trump tartışması yapay zekayla müsabakaya dönüştürüldü! #shorts #zelensky #trump #keşfet,Ulusal Kanal,572229,8322,179,0.31666666666666665,19,719.0,37.8421052631579,2025-03-02 11:25:00
v83hQQ0naPE,World Reacts To Trump-Zelensky Shouting Match At Oval Office | Dawn News English,DawnNews English,231969,3003,1912,3.966666666666667,155,4662.0,30.07741935483871,2025-03-01 11:50:02
vCgH0bI5lL4,Trump Zelenskyy Meeting | Heated Exchange Between Trump and Zelensky | JD Vance | US Ukraine,HW News English,22814,367,12,0.8,1,11.0,11.0,2025-03-01 12:10:13
vK5YREVhUVQ,Trump and Zelenskyy clash in Washington,Sky News,373505,2358,264,317.5,46,845.0,18.369565217391305,2025-02-28 21:31:07
vX6vdbTrabg,"Trump, Zelenski&#39;yi Beyaz Saray&#39;dan kovdu!",Show Ana Haber,439882,2606,825,3.4,73,5297.0,72.56164383561644,2025-03-01 16:39:45
vdUf9qItNw8,Cearta dintre Donald Trump și Volodimir Zelenski/ Subtitrări română,tele:gen,9250,138,16,2.75,3,19.0,6.333333333333333,2025-02-28 23:11:43
vuoaxfi-mKg,Trump-Zelensky : cette photo de Churchill est la meilleure réponse à cette question d’un journaliste,LeHuffPost,392576,3893,1865,1.7333333333333334,170,9058.0,53.28235294117647,2025-03-01 12:04:10
w4PA97r5sbY,Zelensky: I regret ‘not good’ meeting with Trump,Times News,443168,2921,2968,1.7666666666666666,166,10225.0,61.596385542168676,2025-03-01 10:45:32
wOPuUrVNPTY,Trump disses Zelensky as he calls for Putin peace talks,New York Post,6279,77,53,3.35,8,65.0,8.125,2025-05-28 20:28:10
wOXFNpWpBy0,Trump e Zelensky batem boca na Casa Branca,InfoMoney,21067,397,81,2.683333333333333,14,208.0,14.857142857142858,2025-02-28 19:59:41
wPr7roq1YqI,SIKAP KURANG AJAR Zelensky Buat Donald Trump Marah hingga DIUSIR dari Gedung Putih,Harian Surya,899263,14916,971,2.0166666666666666,88,3718.0,42.25,2025-03-02 06:45:48
wTQFvomTcuo,Trump demands Putin sign ceasefire #PuppetRegime #UkraineWar #Trump #Putin,GZERO Media,5807487,129773,1923,0.9,133,22869.0,171.94736842105263,2025-03-14 19:18:19
wVfHfmb2E_g,La rissa con Trump e il &#39;suicidio&#39; assistito di Zelensky,Limes Rivista Italiana di Geopolitica,491263,11908,2067,21.833333333333332,166,5926.0,35.69879518072289,2025-03-01 17:45:06
wYXoVHqxO8g,La fuerte discusión entre Trump y Zelensky: &quot;No estás siendo nada agradecido&quot; |#vlrm,La República - LR+,48340,407,268,2.1166666666666667,23,473.0,20.565217391304348,2025-02-28 21:12:59
wz_42pckM7w,Watch Trudeau speak directly to Trump during blistering speech,CNN,16265768,313566,105749,21.016666666666666,257,192999.0,750.9688715953307,2025-03-04 17:21:18
x-lMqJDRll4,TRUMP ZELENSKI | Seis momentos de broncas sobre Ucrania en la reunión en la Casa Blanca | EL PAÍS,EL PAÍS,212370,846,723,2.3666666666666667,89,2188.0,24.584269662921347,2025-02-28 21:12:29
x-svIUsLIds,Clash avec Trump : Zelensky ne présentera pas d’excuses au président américain,Le Parisien,635963,5865,2397,1.8666666666666667,192,15596.0,81.22916666666667,2025-03-01 09:39:33
x0FsiAurZnM,ZELENSKI Y TRUMP | La discusión ÍNTEGRA en la reunión sobre Ucrania en la Casa Blanca | EL PAÍS,EL PAÍS,1412319,13115,6420,10.683333333333334,232,32080.0,138.27586206896552,2025-02-28 19:30:57
x3u1IUS72rg,Rencontre Trump/Zelensky : négociations de paix au Vatican｜TF1 INFO,TF1 INFO,81937,776,312,2.4,41,1086.0,26.48780487804878,2025-04-26 19:00:46
xDSTAnkjW-U,Reaksi Dunia Usai Trump-Zelensky Cekcok di Ruang Oval Gedung Putih AS,Kompas.com,391001,2993,1499,3.5166666666666666,86,2737.0,31.825581395348838,2025-03-01 07:24:00
xJvbpW0uIYQ,La CONVERSACIÓN COMPLETA SUBTITULADA en CASTELLANO de TRUMP y ZELENSKY en la CASA BLANCA,Diario AS,803046,8285,2745,49.9,139,4900.0,35.25179856115108,2025-03-01 08:01:07
xciKHT_YDDE,Senjata Trump Paksa Presiden Ukraina Zelensky Mundur dari Jabatan,Tribun Jateng,879,14,0,0.7,0,0.0,,2025-03-06 05:02:16
xhGxcuxwbpY,"LIVE: Graham on Trump, Zelensky meeting | FOX 4 News",FOX 4 Dallas-Fort Worth,168131,814,2278,4.45,128,7946.0,62.078125,2025-02-28 19:46:14
xkdXLfV9J4A,Ukraine&#39;s Zelensky Meets US Senators Ahead Of Meeting With Donald Trump | WION Shorts,WION,24213,300,70,0.7666666666666667,14,136.0,9.714285714285714,2025-02-28 21:21:38
xtIAminyN2s,Trump e Zelensky in Vaticano,Max Angioni,1351621,26478,309,1.0166666666666666,22,1047.0,47.59090909090909,2025-04-28 13:46:51
y45ssl8Ul9M,Trump explique pourquoi il a refusé de signer un accord avec Zelensky,Contacts et impacts,233720,11903,1208,0.9833333333333333,85,3574.0,42.04705882352941,2025-03-02 07:00:42
yKjau5eTIRQ,Pres. Trump speaks to reporters after heated meeting with Ukraine&#39;s Zelensky,CNBC Television,188003,2027,3114,7.083333333333333,122,3857.0,31.614754098360656,2025-02-28 23:06:33
yU3CDNPj6E4,On Cam: Macron Jumps In To Save Zelensky From Trump Reprimand In Vatican Amid Pope Funeral?,Times Of India,107196,943,770,3.433333333333333,88,1986.0,22.568181818181817,2025-04-26 14:28:10
yWbK5gfNYd4,‘There is no question this was a setup’: Amb. Susan Rice on Trump’s Oval Office ambush of Zelenskyy,MSNBC,3541079,65160,18985,12.333333333333334,220,111579.0,507.17727272727274,2025-03-01 00:25:03
yhNjZH-Z1xY,Zelensky propõe reunião trilateral com Trump e Putin para negociar o fim da guerra,O POVO,891,17,5,1.5166666666666666,0,0.0,,2025-05-28 13:21:57
ytJA8fwP728,Watch: President Trump clashes with South African President Ramaphosa in Oval Office meeting,CNBC Television,2264058,21582,13732,19.883333333333333,211,33605.0,159.2654028436019,2025-05-22 01:18:41
z6L5ogsm2jo,Ukrainians In Poland Fear For Country&#39;s Future After Tense Trump-Zelensky Meeting | WION Shorts,WION,9137,128,18,0.85,2,12.0,6.0,2025-03-02 16:52:14
zT2QzZGac-0,Watch Full: Trump Vs Zelensky Vs Vance Showdown In White House | Trump Zelensky Meeting,Hindustan Times,973137,10826,6060,46.766666666666666,191,15035.0,78.717277486911,2025-02-28 20:15:22
zVKbBAehQ8I,"EE.UU. - UCRANIA: El LENGUAJE NO VERBAL, CLAVE en el ENCONTRONAZO entre TRUMP y ZELENSKI | RTVE",RTVE Noticias,140936,1089,674,1.85,76,1533.0,20.17105263157895,2025-03-01 15:56:24
zVYfQ671su0,Zelensky diz que não vai se desculpar após bate-boca com Trump,UOL,161731,3795,1357,2.283333333333333,116,5156.0,44.44827586206897,2025-03-01 01:56:29
zWicr-3RLI0,#vittoriofeltri: &quot;DA SOLO NON HA SPERANZA&quot; #zelensky #trump #ucrania #politica #shorts,POLITICAMENTE SCORRETTO,83224,5524,374,0.9833333333333333,65,2136.0,32.86153846153846,2025-03-06 06:15:03
z_18NrXqGNo,জেলেনস্কির কি স্যুট নেই? #zelensky #trump #ukraine #internationalnews,BVNEWS24,732502,21943,137,0.9333333333333333,14,868.0,62.0,2025-03-01 10:20:02
