video_id,video_title,channel_title,view_count,like_count,total_comments,duration_minutes,comments_collected,total_comment_likes,avg_comment_likes,published_at
-15yqacBdrE,Zelensky Plays APT on Guitar for Trump,Fodi,2162433,14574,1379,0.21666666666666667,49,6434.0,131.30612244897958,2025-03-07 10:47:51
-9U4qSpUmeA,Tranh cãi Trump Zelensky lại bùng lên khi Mỹ cố gắng thúc đẩy thỏa thuận về Ukraine,Báo Thanh Niên,32437,183,0,7.716666666666667,0,0.0,,2025-04-24 06:35:06
-RGj1nXG-n8,Zelensky deixa a Casa Branca após reunião acalorada com Donald Trump | CNN 360º,CNN Brasil,49348,851,416,1.9833333333333334,36,966.0,26.833333333333332,2025-02-28 19:01:19
-SYunbrY7sc,Trump DIDN&#39;T SEE IT COMING: Zelensky’s trip to South Africa STUNS HIM,Diario AS,1779,15,2,2.033333333333333,1,6.0,6.0,2025-05-21 18:08:35
-Vj0PtXFfkI,What&#39;s next for US and Ukraine relations ? #zelensky #trump,Prabhat Exam,3381,146,2,1.25,0,0.0,,2025-03-04 06:17:39
-XB4x0lQhAA,BREAKING NEWS: Trump Speaks To Reporters After Fiery Oval Office Clash With Ukraine&#39;s Zelensky,Forbes Breaking News,1750784,30292,12362,8.166666666666666,195,42083.0,215.81025641025641,2025-02-28 22:59:30
-ZWiBfe4Wy4,Una volta in Vaticano... _#rome #midjourney #roma #giubileo #pope #papafrancisco #zelensky #trump,cosplay,1204655,4279,45,0.18333333333333332,4,21.0,5.25,2025-04-27 03:15:31
-aZIoO9Yql4,Affrontement entre Donald Trump et Volodymyr Zelensky : la réaction du consul ukrainien,Radio-Canada Info,69555,0,469,6.533333333333333,51,838.0,16.431372549019606,2025-03-01 01:38:37
-d0L279pnN4,¿Por qué Trump se enfrentó a Zelenski?,Sky News en Español,259263,0,141,1.25,10,144.0,14.4,2025-03-03 16:40:40
-onI385ehD8,Schiff DESTROYS Trump over HIS MELTDOWN with Zelenskyy,MeidasTouch,2283369,109469,22555,11.766666666666667,221,92903.0,420.3755656108597,2025-03-01 02:46:07
-tcW0xh2RB8,Trump &amp; Zelensky meet for first time since White House spat at Pope&#39;s funeral,The Sun,78888,486,429,1.9166666666666667,43,613.0,14.255813953488373,2025-04-26 09:30:01
0592WQjKYyc,Ukraine War: Trump के साथ बहस के बाद Zelensky के तेवर हुए ढीले? | N18S,News18 India,1130481,22951,218,0.85,20,283.0,14.15,2025-03-03 06:58:38
06tvV9zROps,FULL: Trump-Zelenskyy Oval Office meeting,LiveNOW from FOX,2308894,29619,18323,52.3,277,64927.0,234.39350180505414,2025-02-28 19:20:09
0BEfdfnG00M,Trump&#39;s STUNNING 5-Word SNUB To Macron Before Meeting Zelensky At Pope Funeral | Watch,Times Of India,626162,5021,2423,3.316666666666667,93,2391.0,25.70967741935484,2025-04-27 17:29:50
0ECfqSLyrig,Piers Morgan Weighs in on the Press Conference Between Trump and Zelensky,Good Morning Britain,1494280,16858,6425,12.8,187,26835.0,143.50267379679144,2025-03-03 10:33:34
0nFtjMfOZRM,BULLETIN PODCAST: My apology to Zelensky; Trump forfeits right to power https://tinyurl.com/ytzpya7k,Keith Olbermann,53291,10099,867,0.8,113,6073.0,53.743362831858406,2025-02-28 21:27:51
19r63QYAvZA,Brooks and Capehart on the implications of Trump&#39;s altercation with Zelenskyy,PBS NewsHour,2129967,34812,0,9.383333333333333,0,0.0,,2025-02-28 23:55:46
1PEoiL0UpbQ,Donald Trump and Volodymyr Zelenskyy meet in St Peter&#39;s Basilica,Sky News,101019,1128,417,3.4,80,1505.0,18.8125,2025-04-26 12:30:07
1UOixeXQxeM,Ces photos de la rencontre entre Trump et Zelensky au Vatican sont déjà historiques,LeHuffPost,181459,1859,631,1.6833333333333333,107,2126.0,19.869158878504674,2025-04-26 14:46:22
27mhF9u9jS4,Trump Dünya Basınının Önünde Zelenski İle Tartıştı | NTV,NTV,712490,4418,2508,6.316666666666666,148,11983.0,80.96621621621621,2025-02-28 19:00:36
2IAby0q7ar8,Trump and Zelensky fight before the world: Full press conference,The Australian,35186,249,365,32.65,44,601.0,13.659090909090908,2025-02-28 21:13:19
2azw1xD3gC0,"Zelensky ने Trump को लेकर दिया बड़ा बयान, टकराव के बाद रुख नरम | Ukraine War | N18S",News18 India,96683,1794,18,0.8833333333333333,1,7.0,7.0,2025-03-05 09:29:05
2mbYpzeaI6c,Trump ha davvero cacciato Macron dal colloquio con Zelensky? Analisi del linguaggio del corpo,Patrick Facciolo,3789,89,38,1.65,1,7.0,7.0,2025-04-29 05:10:00
2vQ85srCmzY,Ontmoeting Trump en Zelensky eindigde in ruzie: &#39;Don&#39;t take the bait&#39; | BEAU,RTL Tonight,235349,1243,2036,23.016666666666666,142,4552.0,32.056338028169016,2025-03-01 07:00:04
3Dx-P_q6iKw,ESPECIAL | TENSIÓN TOTAL EN WASHINGTON: LA REUNIÓN TRUMP-ZELENSKY TERMINA EN BRONCA,Negocios TV,427212,6354,122,308.53333333333336,19,158.0,8.31578947368421,2025-02-28 23:00:05
3K1IXn2llWI,"LIVE: Zelensky, Trump meeting in DC | FOX 26 Houston",FOX 26 Houston,25794,220,165,209.73333333333332,13,171.0,13.153846153846153,2025-02-28 19:32:35
3LYywIWuyU0,Trump Zelensky Meeting: Angry Exchange Between Donald Trump &amp; Zelensky At White House | Trump News,DNAIndiaNews,120893,962,181,7.433333333333334,29,654.0,22.551724137931036,2025-02-28 19:23:26
3YG-QvDpdNY,Tension inouïe entre Trump et Zelensky sur le sort de l’Ukraine,Le Monde,381541,4324,3036,1.9666666666666666,191,14454.0,75.67539267015707,2025-02-28 18:55:18
3jiIf9rAoMw,TRUMP AND ZELENSKY DINNER TOGETHER 🥺 #SUBSCRIBE 🥺🙏,The News guy 69,226,3,2,0.1,0,0.0,,2025-03-04 06:40:55
3nlVTc2E4x4,Trump echa a Macron de una reunión con Zelensky #ucrania #trump #eeuu #francia #macron #politica,Élites del mundo,10392,168,5,0.35,0,0.0,,2025-04-28 22:30:02
3oEYCpnMtMk,Trump-Zelensky Kembali Bertemu di Pemakaman Paus Fransiskus #trump #zelensky #beritasatu,BeritaSatu,18908,169,0,0.35,0,0.0,,2025-04-28 06:36:31
3v0jJBF1qHw,Trump and Zelenskyy&#39;s meeting turns into a heated argument,NPR,293111,6174,1209,2.0166666666666666,107,7371.0,68.88785046728972,2025-02-28 21:39:16
3wR_LqD32iY,ZELENSKY PUBLICA MENSAGEM DE AGRADECIMENTO AOS EUA APÓS BATE-BOCA COM TRUMP,Itatiaia,84802,2234,605,2.316666666666667,69,1275.0,18.47826086956522,2025-02-28 22:44:45
4Mb-fZYcf0E,"Funerali Papa Francesco: da Trump a Zelensky, da Meloni a Macron, i leader mondiali in San Pietro",alanews,236982,1652,452,2.8666666666666667,69,1346.0,19.507246376811594,2025-04-26 09:21:04
4QnsfUxVBxA,"Debat Panas Zelensky, Trump, dan Vance Berakhir Tanpa Kesepakatan",Kompas.com,78149,764,703,3.35,47,1076.0,22.893617021276597,2025-03-01 03:42:01
4gLIkvfZR5M,Ukrainians react to Zelensky and Trump’s heated exchange,CNN,267877,7826,1804,1.6666666666666667,133,3218.0,24.195488721804512,2025-03-01 18:33:52
4he7BzfqTqI,JD Vance confronts Zelensky,Daily Mail World,106630,2100,682,1.3166666666666667,115,4446.0,38.66086956521739,2025-02-28 20:03:21
4phpf8fDywI,"Hádka v Bílém domě: Trump s Vancem chtěli po Zelenském poděkování. Válku pocítíte, opáčil",CNN Prima NEWS,1008995,13153,6621,11.5,265,34283.0,129.3698113207547,2025-02-28 19:38:36
4r_4KlNuPxY,"Full: Putin Breaks Silence with Big Message After Trump Call, Shocks Zelensky with ‘Deal Is...’",Hindustan Times,94776,925,305,4.1,32,430.0,13.4375,2025-05-19 18:15:01
4zlsi2Eoo4o,"Trump-Zelensky : insultes, menaces, chantage... un véritable incident diplomatique ?",RTL  ,280112,2579,2085,34.4,121,3497.0,28.90082644628099,2025-02-28 19:43:30
4zpqBLyTpsg,Trump Launches Blistering New Attack On Zelensky; &#39;You Cannot Do That...&#39; | Russia-Ukraine War,Times Of India,367691,4183,1986,4.55,131,6535.0,49.88549618320611,2025-03-08 01:59:48
4zvRzpbW_G4,"Zelensky Accepts ‘Unconditional Ceasefire’ Proposal, Discusses Nuke Plant With Trump",CRUX,10135,254,66,0.8666666666666667,6,74.0,12.333333333333334,2025-03-20 09:40:51
52o3f7Xmp5s,"❗️ Зеленский, Трамп, Вэнс в Овальном кабинете: полное видео перепалки на русском языке",ВОТ ТАК NOW,6385705,48492,23834,10.616666666666667,257,72167.0,280.8054474708171,2025-03-01 09:32:33
5GhlCUw5lcg,"Zelensky Trump Fight | This Triggered Trump-Zelensky Clash, Then Team Ukraine Was Asked To Leave",NDTV,977529,17346,1187,1.3166666666666667,93,3962.0,42.60215053763441,2025-03-01 10:15:00
5bVBH8eaMB0,Svađa Trumpa i Zelenskog u Bijeloj kući,Al Jazeera Balkans,386009,2677,2607,6.883333333333334,168,8547.0,50.875,2025-02-28 19:29:36
5q8hXHACwlU,Donald Trump &amp; Zelensky clash video in hindi: हिंदी में देखिए दोनों देशों के राष्ट्रपति की पूरी बहस,Navbharat Times नवभारत टाइम्स,20822,243,18,6.55,3,27.0,9.0,2025-03-12 12:30:05
5rsEZTU_xis,Watch the moment Donald Trump and Volodymyr Zelenskyy clashed | ABC NEWS,ABC News (Australia),164351,1130,0,10.183333333333334,0,0.0,,2025-03-01 03:47:33
5u2f-Dk554o,Réactions à l&#39;échange entre D. Trump et V. Zelensky,TV5MONDE Info,139483,813,764,1.5666666666666667,110,2667.0,24.245454545454546,2025-03-01 13:02:10
5vFBY4d7inA,"Zelensky Trump Meeting | Trump Shouts At Zelenskyy In Oval Office Meeting: &#39;Without Us, You...&#39;",NDTV,42757,898,94,2.5166666666666666,12,119.0,9.916666666666666,2025-03-01 05:00:06
5wrDbE24zQM,"15 Menit Pertemuan Trump Zelensky di Sela Pemakaman Paus Fransiskus, Bahas Apa?",Tribun Jateng,3132,25,0,0.7833333333333333,0,0.0,,2025-04-28 08:03:21
67wdMaeMNmc,&#39;An accident waiting to happen&#39;: Christiane Amanpour reacts to Trump-Zelensky shouting match,CNN,420232,8631,2355,1.45,123,6370.0,51.78861788617886,2025-02-28 22:02:21
6F2x9wYQZdo,LIVE | Putin And Trump Skips Turkey Peace Talks | Angry Zelensky Sends A Strong Message | N18G,CNN-News18,10854,110,28,488.5833333333333,0,0.0,,2025-05-15 14:18:18
6GqT6CZvD7E,"Trump Zelensky Meeting Live News Today - Donald Trump News, Zelensky, JD Vance, Putin, Memes",SKizzle,101177,675,35,0.23333333333333334,4,53.0,13.25,2025-02-28 22:34:18
6Iv4AU7MHHs,Trump Zelenskiy&#39;i çocuk gibi azarladı! #shorts #zelensky #trump #keşfet,Ulusal Kanal,244103,3161,533,0.6833333333333333,87,3477.0,39.96551724137931,2025-02-28 19:45:06
6OoRSPjgpDY,&quot;Your Country is In Big Trouble&quot; | Trump Shuts Down Zelensky at Oval Office #trump #shorts,Mojo Story,2684,57,5,0.6833333333333333,0,0.0,,2025-02-28 18:55:32
6QKwSuJswQk,"Trump Asked: &#39;When Zelensky Inevitably Comes Back To The White House, What Do You Expect From Him? &#39;",Forbes Breaking News,175555,781,494,1.6666666666666667,80,1381.0,17.2625,2025-03-06 22:59:14
6TOPGEpuw_A,Zelensky Asks Trump To See Devastation After Russia Attacks Sumy | Subscribe to Firstpost  | N18G,Firstpost,26115,422,175,0.9333333333333333,13,138.0,10.615384615384615,2025-04-14 09:20:06
6VIcuCXwl7A,Nga Hưởng Lợi Từ Cuộc Gặp &quot;Thảm Họa &quot; Của Ông Trump  Zelensky #trump #zelensky #my #nga #putin,Truyền hình Hưng Yên - HYTV,1138,19,0,1.0333333333333334,0,0.0,,2025-03-01 15:48:56
6WlGyWlmgGc,"Zelensky &quot;Regrets&quot; Trump Clash, Ready for Peace Talks | Vantage with Palki Sharma | N18G",Firstpost,347762,4496,891,9.15,73,3231.0,44.26027397260274,2025-03-05 16:55:26
6_DgyE9ebFg,"&#39;Don&#39;t You&#39;ve A Suit&#39;? Trump, Vance Laugh as Zelensky HUMILIATED By U.S Media For Not Wearing A Suit",Oneindia News,38553,191,390,9.4,59,1474.0,24.983050847457626,2025-02-28 21:16:16
6_dEed1_gp4,Trump questions Putin&#39;s commitment to peace after Zelenskyy meeting | Ukraine War,Sky News,289882,1815,1046,1.35,104,5320.0,51.15384615384615,2025-04-26 14:52:05
6mYCa1xnR30,TRUMP vs ZELENSKY DISCUSIÓN COMPLETA en ESPAÑOL subtitulada,Diario AS,376428,3822,2385,10.683333333333334,131,4481.0,34.20610687022901,2025-02-28 19:55:54
6zJJM8okq4I,🚨 EEUU | Así discutieron DONALD TRUMP y ZELENSKI en plena reunión en la CASA BLANCA,Canal 26,23790,114,126,1.7333333333333334,15,168.0,11.2,2025-02-28 20:15:57
70XnzHs3BFQ,Échange extrêmement tendu entre Trump et Zelensky  ｜LCI,LCI,1014794,10778,8488,34.6,208,18752.0,90.15384615384616,2025-02-28 18:48:58
7Nn5cj3hEuA,சத்தமா பேசினா Vs எங்க ஆயுதம் இல்லனா இரண்டே வாரம்தான்... நேருக்கு நேர் மோதிய Trump &amp; Zelensky,BBC News Tamil,647389,15273,430,1.7,44,2628.0,59.72727272727273,2025-03-01 07:54:08
7OKljjgrmW4,Trump Zelenski Basın Toplantısı - 398. Bölüm (Güldür Güldür Show),Güldür Güldür,3858865,47829,1801,16.183333333333334,128,15015.0,117.3046875,2025-03-23 07:30:04
7THU0jPM7l4,Bezoek Zelensky aan Trump voortijdig afgebroken na ruzie in Oval Office,NOS,525043,4258,4951,10.25,188,23279.0,123.82446808510639,2025-02-28 19:59:06
7Uz2bo_tvYA,"LIVE: Zelensky Ready To Salvage Relations, Meet Trump Again: To Solve Real Problems | Starmer | N18G",CNBC-TV18,164951,971,19,714.95,2,11.0,5.5,2025-03-03 20:59:14
7WEMqzgjjBU,TRUMP x ZELENSKY: O QUE ACONTECEU? [com Professor Hoc],Flow Podcast,801565,45121,1511,150.25,146,8897.0,60.93835616438356,2025-03-04 01:51:33
7Y6OR3njg4c,"Funerali Papa Francesco, l&#39;incontro &quot;storico&quot; tra Trump e Zelensky in San Pietro",TG La7,36166,361,258,2.816666666666667,52,631.0,12.134615384615385,2025-04-26 13:20:42
7hGMZBGaBLg,Trump tratou Zelensky tão mal que… #standup #comedia #shorts #fabiorabin #zelensky #trump #humor #sp,Fábio Rabin,80653,5431,79,0.5666666666666667,18,234.0,13.0,2025-03-01 18:18:40
7knMRkascWs,On Cam: Trump Mocks Zelensky After Putin Phone Call - &#39;He&#39;s Not The Easiest…&#39; | Russia| Ukraine,Hindustan Times,72331,674,230,4.433333333333334,16,322.0,20.125,2025-05-20 01:55:17
7pxbGjvcdyY,"Full Meeting between President Trump, VP Vance and Ukrainian President Zelensky in Oval Office",C-SPAN,5850062,56284,38009,49.96666666666667,319,187654.0,588.2570532915361,2025-02-28 22:04:47
8LQjXVLt-Yg,ABD&#39;de tarihi Trump-Zelenskiy kavgası #shorts,Medyascope TV,290620,3634,447,2.8,44,2767.0,62.88636363636363,2025-02-28 19:44:10
8Ll745vGuoY,Ukrainians react to disastrous Trump-Zelensky meeting,Times News,649890,5058,4777,1.6,176,12907.0,73.33522727272727,2025-02-28 23:04:11
8SEyIL2ZniY,Análisis | Confrontación entre Zelensky y Trump fue un desastre diplomático,CNN en Español,819607,12363,3693,8.8,294,12752.0,43.374149659863946,2025-03-01 07:15:00
8WYZDbLYPRU,JD Vance Chuckles at Zelensky Suit Question #trump #zelensky #jdvance,PromoAmbitions,18752,180,99,0.6,8,210.0,26.25,2025-03-05 01:40:10
95HzFjIV0eI,Análise: A discussão entre Trump e Zelensky | WW,CNN Brasil,320267,7394,1882,20.65,116,4114.0,35.46551724137931,2025-03-01 02:10:12
984PoP2slpM,Trump e Zelensky sobem tom e batem boca nos EUA; assista à discussão na íntegra,UOL,206914,2756,1008,7.85,141,6207.0,44.02127659574468,2025-02-28 22:24:46
9J4c3a_YCHc,Reaction from Kyiv on Trump&#39;s aggressive exchange with Zelensky • FRANCE 24 English,FRANCE 24 English,71679,751,801,5.616666666666666,128,2814.0,21.984375,2025-02-28 20:33:55
9KY6mVmTo58,Clash Trump-Zelensky : le fil est-il cassé entre Kiev et Washington ? • FRANCE 24,FRANCE 24,183404,1416,473,13.966666666666667,49,637.0,13.0,2025-03-01 12:42:53
9OcMIGHMtx0,How Ukrainians are responding to heated Trump-Zelenskyy meeting,CBS Evening News,575767,4304,4307,2.5166666666666666,164,6155.0,37.53048780487805,2025-03-01 01:46:29
9aUplcGFXy0,Donald Trump kiss his wife after Zelensky Ukraine meeting 🥺 #SUBSCRIBE 🥺🙏,The News guy 69,2076,11,3,0.1,0,0.0,,2025-03-01 20:42:58
AL4zYCOVtXg,Watch in full as Zelensky and Trump clash in fiery Oval Office exchange | BBC News,BBC News,1122889,8413,7956,30.85,217,38644.0,178.08294930875576,2025-03-01 12:00:47
ANv5FMFscrA,Trump Leaves For Florida After Angry Exchange with Zelensky | WION Shorts,WION,8144,135,14,0.7833333333333333,3,19.0,6.333333333333333,2025-03-01 01:48:19
AX5m_VvdWyw,Zelensky leaves White House after heated Trump clash | AFP,AFP News Agency,151109,1206,1635,2.0,173,9145.0,52.861271676300575,2025-02-28 18:56:18
AgqPL8ew3CM,Tổng thống Trump công kích người đồng cấp Zelensky; Nga tố Kiev không muốn hòa bình,BẢN TIN CHIẾN SỰ MỚI NHẤT,378,13,0,19.0,0,0.0,,2025-03-05 17:00:11
ArwYHy0fFLE,Pertemuan Trump &amp; Zelensky Memanas! Apa yang Terjadi!? - [Metro Pagi Primetime],METRO TV ,40271,448,235,3.316666666666667,24,333.0,13.875,2025-03-01 01:03:16
BDRCq6ZU6WA,American reacts to: Zelensky and Trump have EXPLOSIVE ARGUMENT on video in the White House,Ryan Wuzer,276885,16624,11728,33.983333333333334,282,79996.0,283.6737588652482,2025-02-28 20:47:22
BF3dv5YBA5Q,Clash Trump-Zelensky : &quot;Les Ukrainiens se réveillent avec la certitude qu&#39;ils ont perdu un allié&quot;,FRANCE 24,185352,1610,1174,1.8666666666666667,137,5599.0,40.86861313868613,2025-03-01 10:26:59
BGTfUyChjuo,TRUMP NÓI ZELENSKY RỜI KHỎI NHÀ TRẮNG VÀ CHỬI THẲNG MẶT: “THẰNG TỔNG THỐNG NGU ĐẦN”,Tuyền Văn Hóa,535337,7043,2520,8.216666666666667,123,5921.0,48.13821138211382,2025-03-01 03:07:44
BQncQ0sEXQE,Zelensky tend la main à Trump après leur altercation,Le Monde,262926,2465,1195,2.25,144,3109.0,21.59027777777778,2025-03-03 15:02:44
BSFhTAahxqA,Trump Usir Zelensky Usai Debat Sengit di Gedung Putih,Kompas.com,217513,1345,940,2.65,64,1831.0,28.609375,2025-03-01 06:08:06
BhquAWlke2o,Trump-Zelenskyy meeting gets heated: FULL VIDEO,FOX 5 New York,2817513,34202,17874,49.75,295,72164.0,244.62372881355932,2025-02-28 19:20:36
Bkj_MxrDJII,Trump&#39;s 600 STAFF QUIT Over Zelensky DISASTER MEETING,The Progressive Politics Network,1498259,42870,12798,12.05,266,97062.0,364.89473684210526,2025-02-28 21:50:31
Bposr9TrRV0,"Macron, Trump, Zelensky... Les images des dirigeants aux funérailles du pape François",LeHuffPost,171110,1248,755,1.9833333333333334,148,3359.0,22.695945945945947,2025-04-26 10:00:34
C067qePguRk,Ukrainian President Zelensky and US President Trump meet inside St Peter&#39;s Basilica | BBC News,BBC News,270856,1774,1189,1.9333333333333333,95,3016.0,31.74736842105263,2025-04-26 13:48:38
C2cMvDSy5Bw,Professor: Reunião entre Trump e Zelensky não tem precedentes; Veja íntegra | CNN 360°,CNN Brasil,459969,12810,3716,22.366666666666667,165,11158.0,67.62424242424242,2025-02-28 19:14:30
CHvA1fIjiVo,Zelensky Hopes for White House Return After Trump Clash | Vantage with Palki Sharma | N18G,Firstpost,637533,9666,2841,12.7,159,10330.0,64.96855345911949,2025-03-03 16:57:20
CNK45BYVU2s,Russia Calls Zelensky &quot;Scumbag&quot; After His Argument With Trump | Subscribe to Firstpost | N18G,Firstpost,162483,4087,672,0.8333333333333334,83,1728.0,20.819277108433734,2025-03-01 14:20:11
CSe0ntgfpq4,"Trump, Zelensky shouting match at the White House: FULL",FOX 4 Dallas-Fort Worth,1158968,12823,11050,50.06666666666667,223,32152.0,144.17937219730942,2025-02-28 18:52:43
CUmHvJzHdY4,Lula diz que Zelensky foi humilhado por Trump: ‘cena grotesca’ | AFP,AFP Português,100071,3161,0,1.3833333333333333,0,0.0,,2025-03-01 21:04:40
CUpOMSJ1MdU,Elon Musk Cold Open - SNL,Saturday Night Live,17339741,475575,47464,7.766666666666667,333,613311.0,1841.7747747747749,2025-03-02 05:21:11
CVsrDjXLUcQ,Ông Zelensky Nhờ Mỹ Giám Sát Lệnh Ngừng Bắn #ukraine #zelensky #trump,Truyền hình Hưng Yên - HYTV,2728,29,0,0.95,0,0.0,,2025-03-20 03:30:12
CWl5hhNui08,Clash Trump/Zelensky: réaction d&#39;Emmanuel Macron | AFP Extrait,AFP,107369,821,1246,0.65,135,5004.0,37.06666666666667,2025-02-28 19:39:12
CofUWpy83QA,Watch the heated exchange between Trump and Zelensky in the Oval Office,The Globe and Mail,192470,1816,2955,4.133333333333334,165,8062.0,48.86060606060606,2025-02-28 19:15:32
Cr-bI7M5lO8,Trump: &quot;Mi sembra che Zelensky voglia continuare la guerra&quot;,Il Sole 24 ORE,46703,558,893,1.6333333333333333,92,1869.0,20.315217391304348,2025-03-01 00:51:59
Cyl_1g5wDtk,Trump/Zelensky : tension historique à Washington｜LCI,LCI,515680,4259,4581,81.9,167,8691.0,52.041916167664674,2025-02-28 20:20:55
DK83sAPd_fc,Trump Middle East Trip Cold Open - SNL,Saturday Night Live,5101780,88473,5505,5.583333333333333,201,70260.0,349.55223880597015,2025-05-18 04:11:54
Df8TncPha6I,Where is Trump? 😏,Hatims Shorts,2625770,0,913,0.6833333333333333,63,2804.0,44.507936507936506,2025-05-08 15:57:44
DjkGxCy8XNI,Le clash Trump / Zelensky,RTL  ,125953,1978,61,3.3333333333333335,9,75.0,8.333333333333334,2025-03-03 11:30:50
DqwK_K9maPU,Trump Zelenskyy Meeting | Heated Exchange Between Trump and Zelensky | JD Vance | US Ukraine,HW News English,62942,1034,93,0.8833333333333333,9,114.0,12.666666666666666,2025-03-01 11:51:02
E4Px5UxqHNc,Zelensky And Trump |  &#39;Have You Said Thank You Once?: JD Vance To Zelensky In Trump Zelensky Meeting,NDTV,35825,662,111,1.5,18,530.0,29.444444444444443,2025-03-01 07:00:09
EAeiJAeX6ss,"Zelensky Trump Argument | This Triggered Trump-Zelensky Clash, Then Team Ukraine Was Asked To Leave",NDTV,67787,1290,125,2.8666666666666667,18,335.0,18.61111111111111,2025-03-01 08:46:21
EHEO4zIlv84,#america में #ukraineambassador ओवल ऑफिस में #zelensky- #trump विवाद के दौरान दिखीं परेशान #shorts,IndiaTV,15401,408,8,1.2833333333333334,0,0.0,,2025-03-01 09:32:49
FKGGH68wsF4,Trump Zelensky meeting but it&#39;s ruined by AI,Jubitips,144750,1113,81,1.3666666666666667,17,312.0,18.352941176470587,2025-03-11 16:28:25
FPkMCYdpggw,Cuộc hội đàm &quot;nảy lửa&quot; giữa Tổng thống Donald Trump và Tổng thống Volodymyr Zelensky,BẢN TIN CHIẾN SỰ MỚI NHẤT,207,5,0,18.933333333333334,0,0.0,,2025-03-04 12:00:28
Fos8B_AJvpQ,"Terugkijken: ruzie Trump en Zelensky, topoverleg over Oekraïne",RTL Nieuws,32856,153,190,9.25,34,607.0,17.852941176470587,2025-03-03 17:00:26
FtRP0JrwM4s,"Altercation Trump-Zelensky : en Ukraine, des habitants consternés",franceinfo,258659,1571,1954,1.6833333333333333,167,6057.0,36.26946107784431,2025-03-01 16:15:28
FvyaDD5y9FE,Trump embarrasses Zelensky and the USA in the Whitehouse. #worldnews,Bmore String ,454,31,7,0.8666666666666667,0,0.0,,2025-02-28 21:43:42
FydVJy37fXI,"Clash avec Donald Trump : Volodymyr Zelensky, un &quot;chef de guerre&quot; ne porte pas de costume...｜LCI",LCI,161755,1929,1738,6.333333333333333,103,2179.0,21.155339805825243,2025-03-02 20:00:13
GHf_ImC5r2A,"[FULL] &#39;You&#39;re gambling with World War 3!&#39;: Trump, Zelensky meeting ends in shouting match",The Straits Times,149712,1106,824,7.55,130,3283.0,25.253846153846155,2025-03-01 00:01:33
GP2HSrJx7qY,Altercation Trump-Zelensky : la &quot;consternation&quot; s&#39;empare de l&#39;Ukraine • FRANCE 24,FRANCE 24,72700,449,482,1.8666666666666667,83,2017.0,24.301204819277107,2025-03-01 07:48:03
GToz_Nw0-sI,Trump accuses Zelensky of &#39;gambling with World War III&#39;,Daily Mail World,292611,6066,921,0.4666666666666667,156,6968.0,44.666666666666664,2025-02-28 21:00:23
GYHsQhXoLkg,Le Clash Trump-Zelensky : Le Grave Secret que les Médias Nous Cachent | H5 Motivation,H5 Motivation,972717,33648,7576,23.316666666666666,159,10220.0,64.27672955974843,2025-03-01 15:21:51
Gdij3Gg67cc,‘What you&#39;re doing is very disrespectful’: Trump and Zelenskyy clash during White House meeting,Sky News Australia,451791,10882,7459,10.433333333333334,242,37757.0,156.0206611570248,2025-02-28 19:06:14
GdoCyxHnWZ0,"Trump-Zelensky, i 49 minuti che hanno cambiato la diplomazia tra i due Paesi: il video integrale",Il Fatto Quotidiano,446762,4695,1560,49.75,162,7226.0,44.60493827160494,2025-03-02 16:30:07
GfqLcBwUT_E,Zelenskyy asked whether he owes Trump an apology,Fox News,11772739,171527,104342,23.05,342,296937.0,868.2368421052631,2025-02-28 23:45:06
GhTpHynWMEA,Trump and Zelensky’s Private Meeting at St  Peter’s Basilica Shocks the World,60 Sec Globally,1326,8,1,0.5833333333333334,0,0.0,,2025-04-27 00:00:24
GoKTmxivlVg,Maurizio Crozza sul confronto tra Zelensky e Trump | Fratelli di Crozza,NOVE,443254,6785,1277,3.966666666666667,147,4087.0,27.802721088435373,2025-03-01 00:27:35
GsUKnnAVzno,La AMENAZA de TRUMP a ZELENSKY: &quot;Te estás jugando la III GUERRA MUNDIAL&quot;,Diario AS,19276,352,72,0.18333333333333332,6,52.0,8.666666666666666,2025-02-28 20:13:14
Gy4IpWUq4Is,Trump slams Zelensky for refusing to recognize Russian control of Crimea,CNN,218583,2427,2558,11.016666666666667,129,7706.0,59.736434108527135,2025-04-23 22:00:17
H0uPWS4GJUc,BREAKING: Trump And Zelensky Sit Down For Meeting In St Peter&#39;s Basilica | WION Shorts,WION,30232,288,52,0.48333333333333334,7,61.0,8.714285714285714,2025-04-26 11:49:47
H7JaYe-Dktg,El tenso enfrentamiento entre Trump y Zelensky en la Casa Blanca #shorts,BBC News Mundo,137354,3092,549,1.4833333333333334,63,1876.0,29.77777777777778,2025-02-28 22:17:18
H7jYcuGHCxI,Trump&#39;s Furious Rant At Zelensky Amid Putin Death Scare By Ukraine UAV: &#39;Everything From His Mouth…&#39;,Hindustan Times,24803,302,120,5.566666666666666,13,174.0,13.384615384615385,2025-05-26 08:40:38
HB-ioav30XI,Trump Zelenskyy Meeting | Heated Exchange Between JD Vance &amp; Zelensky | US Ukraine Relations,HW News English,6956,124,13,0.9833333333333333,3,35.0,11.666666666666666,2025-03-01 11:30:30
HFzIhPkfnXM,News Ki Pathshala | Sushant Sinha: हीरो बन रहे थे Zelensky..Trump ने हेकड़ी निकाल दी ! | #shorts,TIMES NOW Navbharat,1730596,26955,917,0.6333333333333333,24,1122.0,46.75,2025-03-03 16:10:31
HLQuDXQsTVg,Clash Trump-Zelensky : quelles réactions aux États-Unis ? • FRANCE 24,FRANCE 24,139423,1039,578,3.3833333333333333,84,1713.0,20.392857142857142,2025-03-01 14:40:46
HOJS3qQlVjE,Vice President JD Vance reveals the moment the Trump-Zelenskyy meeting &#39;went off the rails&#39;,Fox News,4744443,114451,33261,13.933333333333334,194,34931.0,180.05670103092783,2025-03-04 03:00:06
HQSEpmRttOA,💥White House ERUPTS During Trump Zelensky Press Conference!,The Behavior Panel,184922,9002,5806,72.65,179,5920.0,33.072625698324025,2025-03-13 16:30:07
HYkxls8aSNQ,Zelensky critiqué car il &quot;ne porte pas de costume&quot;,Le Monde,435223,2598,2687,0.5833333333333334,169,17497.0,103.53254437869822,2025-02-28 20:41:35
